text,user_id_hashed,war,ua,ru,datetime,media
"В хорошую компанию Олег попал... Михалков уже там. Держитесь, ребята, правда за нами!",49693aa421cfd3e56a7e7031e4eb8efd,0.023819957,0.00060343754,0.99939656,2022-03-05 15:40:58,Govorit moskva
Да пусть всех граждан РФ в розыск обьявляет) не долго ей осталось на этой должности находиться...,681126c40c5f308dc9d1609c3961bd48,0.00076335744,0.07862219,0.92137784,2022-03-05 15:52:49,Govorit moskva
"Газманов — легенда, а кто эта Венедиктова... очередная мелководная гниль, вот ей и завидно.",bf5cb62633ddfb883681892a79190610,9.1829625e-06,0.022240309,0.97775966,2022-03-05 18:08:50,Govorit moskva
"Доренко в гробу перевернулся. Все СМИ умерли, а вы говном обернулись",e342b9161e01526903f7bfdc5a90ec2f,0.999995,0.195801,0.80419904,2022-03-06 19:47:49,Govorit moskva
"[id681126c40c5f308dc9d1609c3961bd48|Геннадий], да чуть чуть осталось. Они и так бегут как крысы с тонущего корабля 😉 """,d034326d8783d0587ac6b2a70e238c85,0.99998915,0.019494914,0.98050505,2022-03-05 16:25:44,Govorit moskva
Путано и непонятно...,7559065ee15ee1b70397e7c84635f078,0.9999691,0.31081223,0.6891878,2022-03-05 14:38:49,Govorit moskva
НАКАЗАНИЕ ЗА ТАКИЕ ФЕЙКИ ДОЛЖНО БЫТЬ ПОЖИЗНЕННЫМ!,03b2afa0931ae1eb53c92454e2c6bc43,8.635871e-05,0.29199743,0.70800257,2022-03-05 13:15:45,Govorit moskva
"кто будет вещать, если посадим пожизненно за фейки всех порхатых и хачиков?",2173fcdccac1389d99e79ee0357df822,0.9999707,7.999921e-05,0.99992,2022-03-06 12:31:20,Govorit moskva
зомби апокалипсис,dcbff78a98e5f4e7623bbbcd672d2839,0.9999944,0.9996126,0.0003873852,2022-03-05 11:05:11,Govorit moskva
Да не актуально уже про корону…,708c89c6a7759555af726038d9256501,0.9999894,0.37851194,0.62148815,2022-03-05 11:25:24,Govorit moskva
А кого потом этот вирус будет поражать?,f0932605c84144455f4a44ab024a4053,0.999987,0.15806906,0.8419309,2022-03-05 11:50:45,Govorit moskva
Мир сошел с ума???.... Какой нахрен вирус с мутациями при ядерном взрыве???... Кому ентот вирус после ядерной бомбы навредить может???...,b905c5e0296f6d42a6e69bb90f9f40b5,0.9999964,0.036396783,0.9636032,2022-03-05 13:15:36,Govorit moskva
"[idf0932605c84144455f4a44ab024a4053|Юлия], штаммы жрать друг друга будут",4fce121ec65c5abc8e19edcde20fd58a,0.99996054,0.1018914,0.8981086,2022-03-05 12:04:33,Govorit moskva
Комуняки жгут 🤦‍♂️,641e68c36af225540bb4db9d6735937e,0.9999963,0.00019391933,0.9998061,2022-03-05 09:48:48,Govorit moskva
ребята. вы никогда не думали.Я что пора бы и делом заняться а не красным ананизмом?,73d0d39d0b67b91d4d0d88203d49bd77,0.49823686,0.012157271,0.9878427,2022-03-05 10:07:46,Govorit moskva
Такие еб ты как и запутинцы. Хотят повернуть историю вспять. Или войти в прошлое. Всё поезд ушёл.,51c25753f290359825fe1aa7625871e6,0.9999963,0.44789454,0.5521055,2022-03-05 10:14:30,Govorit moskva
"Они дебилы? Пора запретить коммунистов, вот это действительно сплотит нормальных граждан.",d46f8d39e97109d36c5600b60e12565a,0.9999943,0.001627004,0.998373,2022-03-05 11:05:59,Govorit moskva
Давно пора,37226e1b6d22bd468ad3193703d4b5ee,0.993859,0.0066124187,0.99338764,2022-03-06 11:03:08,Govorit moskva
"[id51c25753f290359825fe1aa7625871e6|Ленард], нет, это вранье !!!Идем только вперед, прошлое пусть остается в прошлом, только память возьмем с собой и самое хорошее из СССР тоже можно взять!!! СЛАВА РОССИИ!!!🇷🇺🇷🇺🇷🇺",ff2b184d7e87af155f07545f7f2c882d,0.99999595,0.00033491253,0.99966514,2022-03-05 10:45:20,Govorit moskva
"[idff2b184d7e87af155f07545f7f2c882d|Людмила], При пиз нутые. Вы как правило с неудавшейся женской судьбой, детей у вас как правило нет. Городские сумасшедшие. Всю свою не растраченую энергию персонофицииунте на альфа самца в стае. Таких было полно при гитлере и Муссолини которых они безответно любили. И кончали жизнь самоубийством при их смерти.",51c25753f290359825fe1aa7625871e6,0.9999963,0.44789454,0.5521055,2022-03-05 10:52:23,Govorit moskva
Жрать хочу...,8bf949c9d801754837732992e20cc7fb,0.9998465,0.08747327,0.9125267,2022-03-05 13:17:34,Govorit moskva
Это который отравил Александра Литвиненко радиоактивным полонием?,7559065ee15ee1b70397e7c84635f078,0.9999691,0.31081223,0.6891878,2022-03-05 08:36:39,Govorit moskva
До…лбоеб этот автор.,3e3731d8e8d8651e05e5bfc51019067b,0.9999814,0.00012471067,0.9998753,2022-03-05 08:52:10,Govorit moskva
"[id7559065ee15ee1b70397e7c84635f078|Владимир], именно",e342b9161e01526903f7bfdc5a90ec2f,0.999995,0.195801,0.80419904,2022-03-05 08:47:06,Govorit moskva
Мы ещё и про ковид помним?),209242d51d9ee28a8534232d69a92e32,0.9999932,0.00074905314,0.999251,2022-03-05 08:23:21,Govorit moskva
"На Кубе классно: ни пцр, ни вакцины не нужны",708c89c6a7759555af726038d9256501,0.9999894,0.37851194,0.62148815,2022-03-05 11:26:31,Govorit moskva
Мальдивы какие то…. а где это под Тверью?,9fc3e7aa11c5f681b85c8f1cbf880af1,0.9999485,0.10605883,0.89394116,2022-03-06 09:40:33,Govorit moskva
"Щас, лошадей уже седлаем и скачем) с чемоданом рублей",6c63cc10b46daa0d04fe0ed8c5816f84,1.0358055e-05,0.0004060815,0.9995939,2022-03-06 12:55:10,Govorit moskva
"[id708c89c6a7759555af726038d9256501|Andrey], жаль только попасть туда нельзя)",4d35c7d7549843775218b60187099611,0.9997869,0.3637825,0.63621753,2022-03-05 11:43:22,Govorit moskva
"[id4d35c7d7549843775218b60187099611|Владимир], можно, через Турцию, Казахстан, ОАЭ и тд. только за невменяемые деньги.",708c89c6a7759555af726038d9256501,0.9999894,0.37851194,0.62148815,2022-03-05 11:48:22,Govorit moskva
"Идиоты! Лишаются огромного рынка, потребитель перейдёт на китайские гаджеты, а обратно уже многие не вернутся- привыкнут. Туда им и дорога, вместе с ,,огрызком,,",35f47e4d35e86685b7c931a7d7b0ec5c,1.017476e-05,0.04778046,0.9522196,2022-03-05 02:56:42,Govorit moskva
"Только что писали, что Южная Корея не прекращает поставки и связи с Россией. Не в их интересах.",92ac1da04a59fb4a8a41e7f9744256c9,0.9999964,0.9949987,0.0050013443,2022-03-05 03:50:36,Govorit moskva
"Теперь к ин.агент добавилось необходимость писать - сказка/и. ""Здравствуйте, в эфире ин.агент, рубрика сказки"".",8f8541b1ecce1185b5c74e1b4991fdc6,0.9997738,0.10884272,0.8911573,2022-03-05 01:59:59,Govorit moskva
…домой!! Лжецы!!,74a8e7c2db329cd048febcd619c90491,2.2302924e-05,0.014356445,0.9856435,2022-03-05 04:24:12,Govorit moskva
"Фейки запретили и вещать нечего , вот и закрылись",d14308d4e6ea173fa4bafd8f67717af5,0.99999595,0.00012137385,0.99987864,2022-03-05 19:02:03,Govorit moskva
🔥,3e3731d8e8d8651e05e5bfc51019067b,0.9999814,0.00012471067,0.9998753,2022-03-04 22:09:53,Govorit moskva
Надеюсь они не посмеют вернуться обратно,6c63cc10b46daa0d04fe0ed8c5816f84,1.0358055e-05,0.0004060815,0.9995939,2022-03-05 03:44:25,Govorit moskva
АбиднА! я ток на чЮмадан наэкономил стопитсот баксов. и как теперь быть?,d4799e69faa0dfeeb78e0cffa2de6e63,0.9999666,0.4413005,0.5586995,2022-03-05 05:31:15,Govorit moskva
как это пережить?)),4d35c7d7549843775218b60187099611,0.9997869,0.3637825,0.63621753,2022-03-05 14:55:14,Govorit moskva
Переживём,49693aa421cfd3e56a7e7031e4eb8efd,0.023819957,0.00060343754,0.99939656,2022-03-05 15:20:41,Govorit moskva
Очень жаль 😒 Возвращайтесь поскорее,727d72fd0c64e3b2ca7a571c6c0cd5ef,0.00016511051,0.011257259,0.9887427,2022-03-06 04:43:07,Govorit moskva
сегодня пойду туда схожу и осмотрюсь,73d0d39d0b67b91d4d0d88203d49bd77,0.49823686,0.012157271,0.9878427,2022-03-05 01:58:18,Govorit moskva
"Правильно, давно пора с этими паникёрами бороться.. смешно конечно смотреть на таких людей, которые стоят везде в этих много часовых очередях, мокрые, потные, уставшие., пыхтят, но продолжают стоять🤦‍♂️",708c89c6a7759555af726038d9256501,0.9999894,0.37851194,0.62148815,2022-03-05 05:27:30,Govorit moskva
По кг упаковок давно нет,732ab099825dbb28296c27f795acc56d,0.9999957,4.9391496e-05,0.99995065,2022-03-05 06:17:55,Govorit moskva
таким образом сеть пытается устроить ажиотаж.,4d35c7d7549843775218b60187099611,0.9997869,0.3637825,0.63621753,2022-03-05 11:42:21,Govorit moskva
Маразм крепчает.,5d55d9dac8986d5e262026ff8e5430ad,0.9999963,0.004111684,0.9958883,2022-03-04 18:51:29,Govorit moskva
"Сергей Леонидович, кажется, говорил в своих эфирах: ""идея, доведенная до максимума обращается своей противоположностью"". Вся эта волна запретов и ограничений достигает максимума, поэтому возникает ощущение отвращения к политиканам, орущим во всё горло, что это в интересах страны, другого выхода нет и т.д. и т.п..... Вас лишком много... Надоело...",942fb7344a7efa6a5bbb3a73051473da,0.99999213,0.00031643716,0.9996836,2022-03-04 19:18:02,Govorit moskva
Давно пора.,7d98ee8aa21978e95c4ae9e0963a12f3,0.9999962,0.51080066,0.48919943,2022-03-04 19:43:22,Govorit moskva
🤣🤣🤣🤣👍,e342b9161e01526903f7bfdc5a90ec2f,0.999995,0.195801,0.80419904,2022-03-05 04:47:01,Govorit moskva
"Доренко свободу уважал, а вы дерьмо вовино",e342b9161e01526903f7bfdc5a90ec2f,0.999995,0.195801,0.80419904,2022-03-05 04:47:39,Govorit moskva
"Немчура дурачье... Амеры, китайцы и индусы займут место...  Теряйте рынок...",38f42b471b5e10df59c82cd387d0159b,2.8583572e-06,0.18962194,0.81037813,2022-03-04 18:11:50,Govorit moskva
"инвестиции?))) они инвестировали?)) производство на купленных за копейки площадях, импорт продукции - это инвестиции?))",4d35c7d7549843775218b60187099611,0.9997869,0.3637825,0.63621753,2022-03-05 11:40:10,Govorit moskva
Челом бил😅,22986249859676f28217512623981c03,0.9999894,0.002906465,0.99709356,2022-03-04 17:17:22,Govorit moskva
Samsung топ,395ab04f696fed114ee03505e5571387,0.99971163,0.019671699,0.9803284,2022-03-04 21:20:14,Govorit moskva
Да ладно??? А я то думал там житуха огого 🤦‍♂️… Америку открыли….,708c89c6a7759555af726038d9256501,0.9999894,0.37851194,0.62148815,2022-03-04 15:16:51,Govorit moskva
Есть к чему стремиться!,e342b9161e01526903f7bfdc5a90ec2f,0.999995,0.195801,0.80419904,2022-03-04 15:28:23,Govorit moskva
Радость то какая! Не пропадём!,d985a75069996856dd3b0f202a7bc2d7,0.9999945,0.007890274,0.9921097,2022-03-05 10:28:03,Govorit moskva
Зачем это? Так готовите народ?,3e3731d8e8d8651e05e5bfc51019067b,0.9999814,0.00012471067,0.9998753,2022-03-05 15:52:51,Govorit moskva
"Как ""в связке с правительством""? ""Свободный независимый бизнес""- и в связке?! Может ещё и о спецслужбами?.. Все мифы рушатся. Даже жаль немного наших хомячков, которые молились на Запад..",692e71311ed3842bf2b39aefb59aa813,0.9999939,0.058299627,0.94170046,2022-03-04 14:29:54,Govorit moskva
Линукс победил 😁,47c4ad6dc540dfae75cffb1c5a36dd75,0.95891273,0.007483602,0.99251646,2022-03-04 16:02:27,Govorit moskva
"[id47c4ad6dc540dfae75cffb1c5a36dd75|Аня], где? когда? кого? Вот не удивлюсь, что он и этот мегашанс упустит.",8b16d9259d91658d073eb8c1e36aea85,0.9999809,0.05332364,0.9466764,2022-03-04 17:44:07,Govorit moskva
Литвиненко не снится?,e342b9161e01526903f7bfdc5a90ec2f,0.999995,0.195801,0.80419904,2022-03-04 15:29:26,Govorit moskva
"Наступать надо там где не ждут, через Одесскую область, Приднестровье на Винницкую, Черновицкую и Ивано-франковскую области до Ужгорода, где Закарпатская Русь жаждет присоединится к России. Одновременно со стороны Беларусь наступать на Волынскую и Львовскую области вдоль границы с Польшей отрезая Западенщину и Украину в целом от помощи Запада и его добровольцев. Наступать в обоих направлениях могли бы 70 тыс Чеченцев еще не увязнувших в боях, возможно при помощи войск Беларусь, если пообещать Беларусь вернуть Луцк, а также часть Ровенской и Житомирской областей переданных Сталиным Хрущёву когда тот был первым секретарём Украины. Захват Ужгорода и перекрытие границы с Польшей означал бы полную победу и окончание войны с отменой санкций. После этого в одностороннем порядке, Левому берегу Днепра следует вернуть старое название Российская Слободянщина, побережъю Черного моря - Новороссия, не забудем и Малороссию и Руину, с 6 областями у каждой, вернув последней древнее название - Красная Русь Данилы Галицкого.",2173fcdccac1389d99e79ee0357df822,0.9999707,7.999921e-05,0.99992,2022-03-04 13:29:02,Govorit moskva
Смех,3e3731d8e8d8651e05e5bfc51019067b,0.9999814,0.00012471067,0.9998753,2022-03-05 14:42:37,Govorit moskva
Ну вообще-то говорилось о том что по ней Российские танки стреляли.,8cddbb0372d85270d03d781fd3aef8cf,0.9999831,0.005862322,0.99413764,2022-03-05 15:18:19,Govorit moskva
"Правильная мысль! Что упало, то пропало.",d5798c57700e8d9c9095d2be2d09184a,0.9999963,0.0021780452,0.9978219,2022-03-05 12:27:43,Govorit moskva
"Согласна с предложением профсоюзов о национализации тех предприятий, где не будут платить зарплаты. Во время пандемии частично или полностью были национализированы очень многие предприятия в Европе. Некоторые временно, лет на пять. И все остались в плюсе. Работники с зарплатами, работодатели с деньгами, государство с налогами и занятостью населения. Никакого смысла просто смотреть, как предприятие банкротится, а станки потом конкурсные управляющие сдают на металлолом – нет",193189e84a1df65c92660a7aa64200e3,0.00017722002,0.00026878226,0.99973124,2022-03-07 05:58:53,Govorit moskva
еально все правильно. Где теперь людям будет работать? Этот межнациональный беспредел отражается на простых работяг. Видимо только профки замечают. Жаль.,d81b12c976574961fa629859bdd0f8e5,4.5782297e-05,0.03626262,0.96373737,2022-03-07 08:30:09,Govorit moskva
Прикольно ... на Рублевке тоже ... !!!??? ☝😜😜😜,a961025e913206458e2b77fa2f8f2385,0.007487147,0.004490196,0.99550986,2022-03-04 16:27:39,Govorit moskva
"Результаты есть , хоть один адекватный репортёр скажет , что там сколько можно воевать и куда ведет война !!",871366e4c8de585ab3c70910ab88cc0e,0.9999933,0.14758794,0.85241205,2022-03-04 11:19:47,Govorit moskva
Давайте поможем продлить срок службы самолётов и на доступные расстояния будем ездить поездами.,bcab4c7f17540eea11e051620971ca15,1.6201685e-06,0.0027670558,0.997233,2022-03-04 08:43:06,Govorit moskva
очень странный «эксперт»,4d35c7d7549843775218b60187099611,0.9997869,0.3637825,0.63621753,2022-03-04 09:09:31,Govorit moskva
Вот вы упрямые! Не будет ничего - ни перелетов ни машин. Скоро просто вернёмся в ссср,13beacd4682913c6c56db54ce2d4bf5e,5.2604846e-05,0.09189899,0.90810096,2022-03-04 17:12:13,Govorit moskva
Ну нахер🤣,9e406194670796816a598d4e38d94435,0.99956506,0.010116901,0.9898831,2022-03-04 18:55:58,Govorit moskva
"[id4d35c7d7549843775218b60187099611|Владимир], далекий от авиации",73d0d39d0b67b91d4d0d88203d49bd77,0.49823686,0.012157271,0.9878427,2022-03-04 16:42:48,Govorit moskva
"[id13beacd4682913c6c56db54ce2d4bf5e|Иван], в СССР были и самолёты и машины, а ещё там была развитая промышленность и на тот момент современные технологии, поэтому вернуться туда не так просто.",4d35c7d7549843775218b60187099611,0.9997869,0.3637825,0.63621753,2022-03-05 11:34:40,Govorit moskva
"[id13beacd4682913c6c56db54ce2d4bf5e|Иван], иудей",22986249859676f28217512623981c03,0.9999894,0.002906465,0.99709356,2022-03-05 18:46:48,Govorit moskva
…ура друзья🇷🇺✊,74a8e7c2db329cd048febcd619c90491,2.2302924e-05,0.014356445,0.9856435,2022-03-04 07:10:56,Govorit moskva
Сколько до Киева?,52ed4882b86a0d83f6a15397033c0c2b,0.00036653344,0.0041331146,0.9958669,2022-03-04 07:44:07,Govorit moskva
пора уж заканчивать. ценники пипец в магазах ..,5b3a184aa455a32f4f0f6d2e5921eb40,0.99583983,0.0811765,0.91882354,2022-03-04 10:17:01,Govorit moskva
США - это рассадник всякой гадости.,8dc690042a7c2bf35477064d8ebfe6cf,0.99917173,0.023564266,0.9764357,2022-03-03 19:57:27,Govorit moskva
Но Байден лучший глава антикоррупционного комитета на сегодняшний день 🤣,641e68c36af225540bb4db9d6735937e,0.9999963,0.00019391933,0.9998061,2022-03-03 20:14:26,Govorit moskva
Судьба и Родина едины!,b50d56736729a23e64ee5cfe3e353e01,0.9999865,0.40016192,0.5998381,2022-03-03 18:21:02,Govorit moskva
….какие все Русские фамилии…!!!!!!😁,ad245d863a86bbd2ad66eb8b22a9e739,0.99997926,0.29736963,0.70263034,2022-03-03 16:31:28,Govorit moskva
"Кому стыдно, что он русский, может не волноваться - он не русский...",af8fb7d330d77df26dd79bf174751782,0.99996173,0.076274075,0.9237259,2022-03-03 17:07:48,Govorit moskva
"Чтож вы г...ы сдали назад... 🤣 Вот и вся их ""принципиальность"". Надеюсь их уволят. Давно пора. Пусть на вольных хлебах процветают.",d46f8d39e97109d36c5600b60e12565a,0.9999943,0.001627004,0.998373,2022-03-03 17:34:33,Govorit moskva
"В думе ёбн..ые, так и тут такие же...",e342b9161e01526903f7bfdc5a90ec2f,0.999995,0.195801,0.80419904,2022-03-04 15:25:43,Govorit moskva
Воланд ёпт🤧,209242d51d9ee28a8534232d69a92e32,0.9999932,0.00074905314,0.999251,2022-03-04 15:39:21,Govorit moskva
..наслужат они,ad245d863a86bbd2ad66eb8b22a9e739,0.99997926,0.29736963,0.70263034,2022-03-03 15:32:45,Govorit moskva
И пополнят ряды дезертиров,88f394ea9e107708a174bf84fb0edafe,0.9999963,0.0021660053,0.997834,2022-03-03 15:34:09,Govorit moskva
Неужто такую задумку задумали всего лишь два гоблина?,7559065ee15ee1b70397e7c84635f078,0.9999691,0.31081223,0.6891878,2022-03-03 15:35:49,Govorit moskva
🤦🏼‍♂️,3e3731d8e8d8651e05e5bfc51019067b,0.9999814,0.00012471067,0.9998753,2022-03-03 16:05:54,Govorit moskva
"А пусть отправятся ВСЕ кто верит в освободительную миссию. И посмотрите какие вы  ""ОСВОБОДИТЕЛИ"".    ГАНЬБА!!!!",db0a832ff3417f00d64b8df22c487e67,0.9999958,0.00017601479,0.999824,2022-03-03 16:23:05,Govorit moskva
вообще дебилы что ли,6093fc824a1cde129a7a2100bf3f49f2,0.00039168884,0.25653213,0.7434679,2022-03-03 16:30:48,Govorit moskva
Оне там навоюют ыыышшшоооо на целый век войны!. В Сибирь их на строительство новых городов!!!,b905c5e0296f6d42a6e69bb90f9f40b5,0.9999964,0.036396783,0.9636032,2022-03-03 16:30:51,Govorit moskva
И ваше радио отправить всё,e342b9161e01526903f7bfdc5a90ec2f,0.999995,0.195801,0.80419904,2022-03-04 05:21:25,Govorit moskva
"[idad245d863a86bbd2ad66eb8b22a9e739|Роман], ВРАНЬЁ, ГРУППА ФЭЙК.",a63bfa36fa0112fc5e46d78688622655,0.99996614,0.010912805,0.9890872,2022-03-03 15:34:22,Govorit moskva
Н-да….и это Утинская Россия и его приближённые,3e3731d8e8d8651e05e5bfc51019067b,0.9999814,0.00012471067,0.9998753,2022-03-03 15:21:17,Govorit moskva
"Странно.""Нацисты"" и чеченцы воюют вместе.Видимо нам что то не так преподносят.",d807e28f5da8b8a61e37933594396ae6,0.9999964,0.763865,0.23613504,2022-03-03 15:25:31,Govorit moskva
"Из своего кармана заплатит получается) Да, нехило у него бабосиков)",4fce121ec65c5abc8e19edcde20fd58a,0.99996054,0.1018914,0.8981086,2022-03-03 15:28:15,Govorit moskva
Это утка для елитных наёмников - он так двух зайцев поймает - и убитого и того кому обещал бабла отсыпать 🤔,2f17d2832ea2d2705a820180023fb0eb,0.99999595,0.00079021475,0.9992098,2022-03-03 16:01:45,Govorit moskva
ПОРА ЗАКРЫВАТЬ ПРОВОКАТОРОВ НА ПРОСТОРАХ ИНТЕРНЕТА !  ТЬФУ,1bcf5f7ac2f15a2c57758ba0d7cc8f53,0.999995,0.00016466239,0.9998353,2022-03-03 16:39:35,Govorit moskva
"Теперь ждите новостей, шо за голову Кадырова выложат националисты больше.",2e0b647db4f1a971a45375de433852fa,8.4302505e-05,0.02749392,0.9725061,2022-03-03 17:36:08,Govorit moskva
Рамзан вперёд! Нохчи - спасибо! 🇷🇺🔥💥⭐💪🏻,ebb92081e00ce6242d8b7945ebcde013,0.99999523,3.6191293e-05,0.99996376,2022-03-03 21:43:36,Govorit moskva
Бюджет страны раслетаеться!!!,d985a75069996856dd3b0f202a7bc2d7,0.9999945,0.007890274,0.9921097,2022-03-04 05:00:18,Govorit moskva
российские врачи никогда туда и не входили,a63bfa36fa0112fc5e46d78688622655,0.99996614,0.010912805,0.9890872,2022-03-03 15:28:51,Govorit moskva
"Собаки западные ... - сейчас хохло-бандеровцам надают по заднице и займутся их ""облико-морале"" ... !!! ☝😏😏😏",a961025e913206458e2b77fa2f8f2385,0.007487147,0.004490196,0.99550986,2022-03-03 16:49:41,Govorit moskva
