text,user_id_hashed,war,ua,ru,datetime,media
Жаль конечно. Иногда интересные собеседники были.,e5898582c18397a8dab47431c60cfefe,0.99999607,0.38449892,0.6155011,2022-03-04 09:45:10,Mediazona
"[id149445a65fff09eb96e4fb68b4ffc3ce|Олег], Венедиктова не спросили. Он не владелец.",d5f475e3beb9b6956ce096cd28e4e2c3,0.9999964,0.98755693,0.012443094,2022-03-03 14:17:24,Mediazona
"[id3ee512868c2a953bb9ebfae6e816319e|Елена], наоборот, не продаются.  И их не нагнули, потому и самоликвидируются.",8dce2319ee5892aede4695c1beafc95f,0.99999464,0.5211422,0.47885787,2022-03-03 07:42:41,Mediazona
"[id3ee512868c2a953bb9ebfae6e816319e|Елена],  у тебя с логикой большие проблемы...",afb4a845731b53d7253dd1ecf58d8b4f,0.9999962,0.8233038,0.17669617,2022-03-03 08:14:45,Mediazona
Посылать нах,3cbc002483b44c733b1172ef332791f9,0.9999963,0.37093356,0.6290665,2022-03-02 18:37:42,Mediazona
если пошел в военкомат - добровольно согласилсся участвовать в военном преступлении.,758ebb530ef608433c6bf4fcd443b531,0.9999963,0.47893557,0.52106446,2022-03-02 19:48:46,Mediazona
оружие дадут???,9b4abed07d23e9b504d74d3c6233d00e,0.99997926,0.9998427,0.0001573672,2022-03-02 20:20:13,Mediazona
"Тем кто отслужил, ИП откройте и игнорируйте любые истерики МО РФ! Поскольку вы будете юридически не совсем обычным гражданским, с открытым ИП вы уже не обязанным подчиняться им, как военному ведомству, у которого своя полиция (в т.ч. своя авто инспекция), своя прокуратура, свой суд! Человек ПО ЗАКОНУ не может быть действующим военнослужащим и ИП одновременно, а принудить отказаться или ликвидировать открытое ИП без участия самого ИП нельзя. Чем грозит взять человека с открытым ИП в армию: -Он может игнорировать приказы под предлогом отсутствия коммерческой выгоды или убыточности. -Он может совершать коммерческие операци на территории в/ч, поскольку у него открытое ИП. -Он может в судебном порядке требовать возместить ущерб от действий, направленных на упущение его выгоды. -Он не обязан терпеть оскорбления и тяготы срочной службы, а значит запросто выдвинуть через суд счёт за каждое пребывание в суточном наряде. -Его передвижения уже нельзя ограничивать, поскольку это несет вред коммерческим операциям. Ну и для справок, открытое ИП является достаточным основанием для ""Утраты доверия"" к военнослужащему, проходящему службу по контракту, вследствии чего прямой дорогой к расторжению контракта с ним.",20ffa841867b51bc7b648dd6b70a8223,0.9999937,0.23932582,0.7606742,2022-03-02 20:34:46,Mediazona
так призыв весенний с 1 апреля. поэтому и проходят. Что за паника блин,7bf3009469ba6bf1257e4176e686f86a,0.99999595,9.5582844e-05,0.9999044,2022-03-03 08:09:28,Mediazona
"каждый год это происходит, военные сборы.",f49318fbec7bddb1256462bcce0d8a90,4.821669e-05,0.0034683137,0.99653167,2022-03-03 08:37:08,Mediazona
"весенний призыв в апреле, повестки всегда приходили не только в этом году",d36a85e2ae5ba385ed0770e2b52fc6c1,2.8279139e-05,0.047562983,0.952437,2022-03-03 08:40:56,Mediazona
"Ну да, не понимаю сути, каждый год так, чего распаниковались то",888ffef5ae5b59eee5f5069d9526206b,0.9999964,8.0762744e-05,0.9999192,2022-03-03 10:06:40,Mediazona
Так уже было столько инфы что и срочников забирают и вообще все подряд вот люди и боятся,2102cadcef8adb708d0edd1e256b3502,0.9999963,4.740432e-05,0.99995255,2022-03-03 10:08:16,Mediazona
"Даже если эта повестка и приходит, то не из за ситуации на Украине. Обычные сборы, не нужно переживать",0d2f18e09472f4516b737f4219635075,0.9999962,0.0003993978,0.9996006,2022-03-03 11:20:05,Mediazona
"Даже если и придет и поедите на сборы не нужно переживать, обычная процедура. До полигона и обратно",1b18ef10cb739149b7a41470b154c702,0.9999939,0.00017696229,0.99982303,2022-03-03 11:23:35,Mediazona
"Спасибо, что разъяснили, а то как обычно любит наш народ панику ни с чего разводить",d7ad0328a2b76fd54e12c188c50fadff,0.9999957,3.9280432e-05,0.99996066,2022-03-03 22:39:19,Mediazona
"Никто не присылал, никуда не призывал), гнать пургу не надо",3eb37a36fae3a539e15a39f9580f7882,0.9999963,0.0005377603,0.9994623,2022-03-04 08:24:31,Mediazona
"Весенний призыв, никто не отменял, он всегда был и будет. Не надо паники, давайте будем помнить что не обученных ребят, никто на операцию не отправит.",8745fe428ed80ca5de5caee56b3b4708,0.99999523,0.00012792351,0.9998721,2022-03-04 15:39:55,Mediazona
"[id345b39fa7eee004ff0a68cbbdc7bce55|Ксюша], playing muscles.",96c199885506dc7ad0a3dee897c45a10,0.99999547,0.4218416,0.57815844,2022-03-02 22:52:03,Mediazona
"Если не ошибаюсь, за не явку на сборы от100 до 500р штраф😏",fc8b2e70e3b18350521f9728d1270c0e,0.87123775,0.14409554,0.8559044,2022-03-03 03:27:45,Mediazona
"[idfc8b2e70e3b18350521f9728d1270c0e|Сергей], от 500 до 3000 тыс. Но жизнь дороже",99e191a58e56c04e72bd77f7d6fa96af,0.99989665,0.00013040492,0.9998696,2022-03-03 07:05:39,Mediazona
"[id99e191a58e56c04e72bd77f7d6fa96af|Марина], это где столько?",fc8b2e70e3b18350521f9728d1270c0e,0.87123775,0.14409554,0.8559044,2022-03-03 07:09:40,Mediazona
"[id99e191a58e56c04e72bd77f7d6fa96af|Марина], на 2022г",fc8b2e70e3b18350521f9728d1270c0e,0.87123775,0.14409554,0.8559044,2022-03-03 07:10:03,Mediazona
"[idfc8b2e70e3b18350521f9728d1270c0e|Сергей], статья 21.5 КоАП РФ",99e191a58e56c04e72bd77f7d6fa96af,0.99989665,0.00013040492,0.9998696,2022-03-03 07:10:48,Mediazona
"[id99e191a58e56c04e72bd77f7d6fa96af|Марина], значит повысили. Проживал этот момент. Благодарю.",fc8b2e70e3b18350521f9728d1270c0e,0.87123775,0.14409554,0.8559044,2022-03-03 07:14:32,Mediazona
"[idfc8b2e70e3b18350521f9728d1270c0e|Сергей], не за что. И я бы не знала, если бы не вот это всё ((",99e191a58e56c04e72bd77f7d6fa96af,0.99989665,0.00013040492,0.9998696,2022-03-03 07:15:31,Mediazona
"[id345b39fa7eee004ff0a68cbbdc7bce55|Ксюша], срочников на Украине нет, там только контрактники, сколько можно верить уже этим вбросам. а повестка в марте - обычное плановое мероприятие",76d2737abef7d67fca2ced267e8ce5fe,0.99999547,0.0048238626,0.99517614,2022-03-03 08:35:46,Mediazona
Конечно конечно. Все супер. Не мясо. Ихтамнет и русскиймир.,345b39fa7eee004ff0a68cbbdc7bce55,0.99999607,0.99464285,0.0053571053,2022-03-03 08:37:52,Mediazona
"[id76d2737abef7d67fca2ced267e8ce5fe|Мак], дорогой Мак, то, как эти салажата стали контрак..ми, историй сотни. Командиру дан приказ: отправить два батальона. А у него один. Некомплект. Но есть срочники. Кого словами, кого принудительными физическими работами на износ - короче, любой ценой подписать контракт. Вот только сути не меняет: зелёные, неопытные, непрофессиональные. Пушечное мясо, прости Господи. Только бы вернулись. Лучше живыми. Не повезёт - в гробах, на родину, чтобы матери знали, где могила сына, а не братская могила с номерком на ноге.",99e191a58e56c04e72bd77f7d6fa96af,0.99989665,0.00013040492,0.9998696,2022-03-03 08:39:44,Mediazona
"[id99e191a58e56c04e72bd77f7d6fa96af|Марина], прекратите распространять заведомо ложную информацию. имейте в виду, что это наказуемо. на данный момент на Украине нет срочников, там есть только контрактники",76d2737abef7d67fca2ced267e8ce5fe,0.99999547,0.0048238626,0.99517614,2022-03-03 09:02:09,Mediazona
"[id76d2737abef7d67fca2ced267e8ce5fe|Мак], ничего ложного в моих словах нет. Горькая правда)",99e191a58e56c04e72bd77f7d6fa96af,0.99989665,0.00013040492,0.9998696,2022-03-03 09:04:49,Mediazona
"[id99e191a58e56c04e72bd77f7d6fa96af|Марина], а вы можете предъявить какие-то доказательства сказанного Вами? ну кроме этого эмоционлаьного словесного потока? или вы руководствуетесь только укрофашистской пропагандой ?",76d2737abef7d67fca2ced267e8ce5fe,0.99999547,0.0048238626,0.99517614,2022-03-03 09:11:11,Mediazona
"[id76d2737abef7d67fca2ced267e8ce5fe|Мак], а ваши доказательства где? Хочу и верю?",6fa90901c47d11b6d295be9f0585f2d3,0.99999213,0.99785113,0.00214893,2022-03-03 18:31:28,Mediazona
Решил запугать )  Лучше беги за последними европейскими товарами) балаболка,345b39fa7eee004ff0a68cbbdc7bce55,0.99999607,0.99464285,0.0053571053,2022-03-03 18:43:01,Mediazona
Презикдраный),345b39fa7eee004ff0a68cbbdc7bce55,0.99999607,0.99464285,0.0053571053,2022-03-03 18:43:48,Mediazona
"[id3cbc002483b44c733b1172ef332791f9|Сергей], похоже редактору медиазону пришла повестка первый раз и он не знает что это. а вы ведетесь",76d2737abef7d67fca2ced267e8ce5fe,0.99999547,0.0048238626,0.99517614,2022-03-03 08:37:02,Mediazona
"[id20ffa841867b51bc7b648dd6b70a8223|Дмитрий], одна проблема - даже если вы как ИП не получаете прибыли, платить отчисления в ПФР и ФОМС обязаны ежегодно.",af6522aff7f8109294e22495cecd5b16,0.9999821,0.00046275905,0.9995372,2022-03-02 21:41:15,Mediazona
"[idaf6522aff7f8109294e22495cecd5b16|Павел], если эта схема рабочая (я не юрист ни разу), то вроде как невелика цена за роскошь не убивать",758ebb530ef608433c6bf4fcd443b531,0.9999963,0.47893557,0.52106446,2022-03-02 21:42:15,Mediazona
"[idaf6522aff7f8109294e22495cecd5b16|Павел], ежеквартально. Но убыточное ИП никого не убивает, а вот командир идиот - да.",20ffa841867b51bc7b648dd6b70a8223,0.9999937,0.23932582,0.7606742,2022-03-02 21:54:19,Mediazona
"[id20ffa841867b51bc7b648dd6b70a8223|Дмитрий], а у ""самозанятых"" прокатит?",da5bf24f1938b366ac6563bfc7af170b,0.00056530815,0.4746816,0.52531844,2022-03-02 23:46:56,Mediazona
"[idda5bf24f1938b366ac6563bfc7af170b|Бруно], нет, у самозанятых режим налогооблажения в 2 клика меняется. Фактически это обычный гражданский, который приработок свой регистрирует и отчисляет налоги.",20ffa841867b51bc7b648dd6b70a8223,0.9999937,0.23932582,0.7606742,2022-03-02 23:49:43,Mediazona
"[idaf6522aff7f8109294e22495cecd5b16|Павел], если только вы не ИП на НПД ☝️😏",c849074a46f27f728b46bb6809229937,0.9999963,0.9999157,8.4241845e-05,2022-03-03 01:03:28,Mediazona
"[idc849074a46f27f728b46bb6809229937|Илья], спасибо, даже не слышал о таком. Задумался, может, мне самому зарегистрироваться в качестве ИП на НПД.",af6522aff7f8109294e22495cecd5b16,0.9999821,0.00046275905,0.9995372,2022-03-03 11:14:50,Mediazona
"[id20ffa841867b51bc7b648dd6b70a8223|Dmitry], Если ИП призывают в армию, он должен полностью прекратить деятельность. Он не может продолжать заниматься предпринимательской деятельностью ни сам, ни через доверенных лиц. Об этом говорит п. 7 ст. 10 Закона О статусе военнослужащих.",0752e481ac15e70885e4d3244a2c2db9,3.9765335e-05,0.0025659106,0.9974341,2022-03-03 19:13:48,Mediazona
"[id0752e481ac15e70885e4d3244a2c2db9|Илья], не отслуживший срочник, да...Но не запасной.",20ffa841867b51bc7b648dd6b70a8223,0.9999937,0.23932582,0.7606742,2022-03-03 23:01:13,Mediazona
"[idbe6f4fe73ca9aa4f5b2365eb82711cbf|Татьяна], да любые их действия и ""законы"" - преступны!",758ebb530ef608433c6bf4fcd443b531,0.9999963,0.47893557,0.52106446,2022-03-03 06:02:20,Mediazona
А че не 100?,da93407bff0cc18d79f5959afb7f4207,0.9999963,0.0124356225,0.9875644,2022-03-02 16:59:49,Mediazona
"и работать это будет только в одну сторону, конечно же.",dc5b31171236a8aa7f132842f1e86bec,0.9999964,0.42621607,0.573784,2022-03-02 17:05:44,Mediazona
"А то что до сегодняшнего дня Минобороны заявляло, что потерь нет - это, конечно, ни разу не фейковая информация была",daa7776dd46ec8a90a36bc0f8c18f85f,0.11826581,0.001406884,0.99859315,2022-03-02 17:12:35,Mediazona
bitches,3102d6f0aa41588eb8ad20da03fb4df6,0.9999956,0.0020343664,0.9979657,2022-03-02 17:49:30,Mediazona
Страшно стало после этой новости за Минобороны и сотрудников государственных СМИ,da5d2d75f0314014d3d2f29ff09e09e9,4.259947e-05,0.00036640363,0.99963355,2022-03-02 18:11:13,Mediazona
Поздравляю всех нас,10ae0254f2af0061e3504f07b0c54344,6.7924916e-06,0.0021593664,0.9978407,2022-03-02 19:00:21,Mediazona
Фейковая информация это любая другая кроме как результат выборов???,05146be0cc7ab0ed3a674378c954aa90,0.99999285,0.453703,0.546297,2022-03-02 20:44:25,Mediazona
"Да сколько же там откровенных дебилов в этой думе. Дума, наверно забыли или не знали, что это от слова думать:))",ca8a2a15e9c4f2f6729c3f217081fac8,0.99997723,0.9801319,0.019868039,2022-03-03 03:20:45,Mediazona
"ну держись, ботяры- всех найдем и в польше и в германии и в чехии)))",9f12c96684b32086ef35ace8dc0a387a,0.00082656916,0.00019260906,0.9998074,2022-03-03 05:26:01,Mediazona
«Министерство правды» от Оруэлла,b60f2282a6688a3b48568e0dd70f9e88,0.99995685,0.024158863,0.9758412,2022-03-03 09:25:02,Mediazona
"[idda93407bff0cc18d79f5959afb7f4207|Виталий], чтоб не ассоциироваться с курсом валюты",6047aac80821fd9b09834c54e3c84b8e,0.9999963,0.44278625,0.5572138,2022-03-02 17:01:40,Mediazona
"[id6047aac80821fd9b09834c54e3c84b8e|Николай], 🤣🤣🤣🤣🤣🤣",5b4f2ba41223b5a981889b0265b9c722,0.9999957,0.0020631847,0.99793684,2022-03-02 17:49:57,Mediazona
"[iddaa7776dd46ec8a90a36bc0f8c18f85f|Владимир], это другое.",d6af871b0f1661e45024352ab5eab7dd,1.7133098e-05,0.00020520517,0.9997948,2022-03-03 03:14:11,Mediazona
"[id05146be0cc7ab0ed3a674378c954aa90|Юрий], это любая информация, которая не понравилась. Советские политики решили советскими методами урегулировать вопрос, забыли почему вместо союза под ногами Россия.",20ffa841867b51bc7b648dd6b70a8223,0.9999937,0.23932582,0.7606742,2022-03-03 01:54:51,Mediazona
Здравый смысл покинул эту страну. Маразм победил...((,c28378214c5d4ff8212876ad0a3c87a6,0.9999963,0.5225107,0.47748932,2022-03-02 14:19:41,Mediazona
"зная, на что идёт и с чем играется, вписывает детей в такую авантюру, прикрываясь ими - ну такое себе",573ac2f4ac008ee541dbb183dfe68c10,0.9999925,0.0007759656,0.99922407,2022-03-02 14:32:38,Mediazona
Дебилки.,d0cdb861728a6f1e99e44464fec0c54f,0.9999962,0.0075630248,0.99243695,2022-03-02 14:33:40,Mediazona
">Вышли молча возложить цветы к посольству, как их возлагают по всей стране по многим памятным датам >""Азаза, знали же, куда шли, да ещё и детей потащили!!11"" >?????? >Аргумент не против родителей с цветами, а против государства, в котором хватать за это в автозак — уже норма",005a3d496a558342fed7a78084220ffe,0.9999,0.21553761,0.78446245,2022-03-02 14:38:17,Mediazona
Маразм крепчал... почему это уже никого не удивляет? Этот режим не должен просуществовать долго.,c77a0eaf85cb346da45ce7e75bb6490f,0.99999475,0.2041321,0.79586786,2022-03-02 15:25:07,Mediazona
"В Украине и нормальных странах такой херни нет  Ты можешь обораться хоть, что президент мудак и все прочее  В этой же стране тоталитаризм Цензура и прочие ништяки режима.  Путин боится за свою власть",61c2908b115fbc19990f6ad5768cdaf1,0.9999963,0.00023824484,0.99976176,2022-03-02 15:30:59,Mediazona
зачем они приперлись на митинг с детьми?,af413338272f7c2ee354adb7631c8555,0.9999963,0.00033649823,0.9996635,2022-03-02 15:58:24,Mediazona
"Стоп, стоп, стоп!!! Задержали ДВУХ женщин с ПЯТЬЮ детьми... Два человека достаточно для митинга + 5 детей. Вывод - митинг. Можно было бы сказать: - ""Что это такой перфоманс"". Но увы 7 человек с около политическим перфомансом и есть митинг. А далее незаконное вовлечение несовершеннолетних + несогласованный митинг. Детей еще могут и под присмотр опеки направить.",7ad82d4ac9d12434c9d6d63d95a49a5e,0.99975806,0.00046415546,0.9995359,2022-03-02 16:41:29,Mediazona
В чем была угроза? В цветах?,e9ac3fe3c5744b073fcdc80adea249d3,0.99999547,0.019532066,0.9804679,2022-03-02 18:17:28,Mediazona
"Знаю что в стране задерживают всех за такие действия ,идти на них с детьми. Хотела,чтоб не заметили,смысл тогда? Хотеда чтоб заметили? Получилось.",2f290c3dd2dfd37f80a513cc069ef969,0.9997682,0.28672683,0.7132732,2022-03-04 06:24:38,Mediazona
"[id573ac2f4ac008ee541dbb183dfe68c10|Твой], а на что она идёт и с чем играется?",d4b1f91da895099bea1f1aa3af1437d5,0.9999962,0.0046049017,0.9953952,2022-03-02 16:27:37,Mediazona
"[id573ac2f4ac008ee541dbb183dfe68c10|Твой], ну да. Детей через 3-5 лет заберут в армию и отправят на убой, но нужно молчать и не впутывать детей🤣😃 Вы сами понимаете что пишете?! Любите стоять в стойле, молчать и быть рабом-ок. Ваше право. Но почему вы уверены что остальные мечтают так жить.",586bece8b0c88c24c3d1385bceecd54e,0.99996924,0.5124424,0.4875576,2022-03-02 16:28:54,Mediazona
"[idd4b1f91da895099bea1f1aa3af1437d5|John], зная, как наша система любит перекусывать судьбы людей, я бы не стал ввязывать в эту историю собственных детей, потому что силовикам все равно, да и тебе, в общем-то, тоже, а у детей стресс",573ac2f4ac008ee541dbb183dfe68c10,0.9999925,0.0007759656,0.99922407,2022-03-02 16:31:27,Mediazona
"[id573ac2f4ac008ee541dbb183dfe68c10|Твой], пусть привыкают хуле",d4b1f91da895099bea1f1aa3af1437d5,0.9999962,0.0046049017,0.9953952,2022-03-02 16:32:11,Mediazona
"[id586bece8b0c88c24c3d1385bceecd54e|Виталий],",573ac2f4ac008ee541dbb183dfe68c10,0.9999925,0.0007759656,0.99922407,2022-03-02 16:32:27,Mediazona
"[idd4b1f91da895099bea1f1aa3af1437d5|John], це мерзость  зачем им привыкать к такому",573ac2f4ac008ee541dbb183dfe68c10,0.9999925,0.0007759656,0.99922407,2022-03-02 16:33:21,Mediazona
"[id573ac2f4ac008ee541dbb183dfe68c10|Твой], согласен, незачем, но придется",d4b1f91da895099bea1f1aa3af1437d5,0.9999962,0.0046049017,0.9953952,2022-03-02 16:38:10,Mediazona
"[id573ac2f4ac008ee541dbb183dfe68c10|Твой], ты кто такой? идинах,",fd9bbb850f242ac4eaeb819b2c8e38a6,0.9999963,0.6209893,0.3790107,2022-03-02 21:44:21,Mediazona
"[idd0cdb861728a6f1e99e44464fec0c54f|Юлия], а вы самокритичненько...",64e1ac1fd45e6a408317576069f30e69,0.9999765,0.15402593,0.8459741,2022-03-03 06:20:29,Mediazona
"[id61c2908b115fbc19990f6ad5768cdaf1|Ксения], вот ето новость",d4b1f91da895099bea1f1aa3af1437d5,0.9999962,0.0046049017,0.9953952,2022-03-02 16:28:24,Mediazona
"Детей через 3-5 лет заберут в армию и отправят на убой, но нужно молчать и не впутывать детей🤣😃",586bece8b0c88c24c3d1385bceecd54e,0.99996924,0.5124424,0.4875576,2022-03-02 16:29:42,Mediazona
солдат используют как солдат,af413338272f7c2ee354adb7631c8555,0.9999963,0.00033649823,0.9996635,2022-03-02 16:38:00,Mediazona
"это обязанность гражданина - служить в армии (любой страны), а у солдата есть высокий шанс не вернуться домой",af413338272f7c2ee354adb7631c8555,0.9999963,0.00033649823,0.9996635,2022-03-02 18:17:10,Mediazona
"[idaf413338272f7c2ee354adb7631c8555|Лашин], не любой. Далеко не любой.",586bece8b0c88c24c3d1385bceecd54e,0.99996924,0.5124424,0.4875576,2022-03-02 18:17:43,Mediazona
езжай в не любую,af413338272f7c2ee354adb7631c8555,0.9999963,0.00033649823,0.9996635,2022-03-02 18:18:02,Mediazona
"[idaf413338272f7c2ee354adb7631c8555|Лашин], езжай в Северную Корею. Страна мечта для тебя.",586bece8b0c88c24c3d1385bceecd54e,0.99996924,0.5124424,0.4875576,2022-03-02 18:18:25,Mediazona
"я не ною в этой стране, в отличии от тебя - сопли развесил",af413338272f7c2ee354adb7631c8555,0.9999963,0.00033649823,0.9996635,2022-03-02 18:20:35,Mediazona
"[idaf413338272f7c2ee354adb7631c8555|Лашин], тебе и не разрешали.  Всю жизнь в стойле стоишь-стой дальше. Разрешено бееее меееее.  Больше ничего не разрешено тебе 😀😀😀",586bece8b0c88c24c3d1385bceecd54e,0.99996924,0.5124424,0.4875576,2022-03-02 18:21:30,Mediazona
"[id586bece8b0c88c24c3d1385bceecd54e|Виталий], ахтунг, завоняло хохлом!",af413338272f7c2ee354adb7631c8555,0.9999963,0.00033649823,0.9996635,2022-03-02 18:23:55,Mediazona
"[idaf413338272f7c2ee354adb7631c8555|Лашин], всё лучше, чем от тебя рабом 🤣🤣🤣",586bece8b0c88c24c3d1385bceecd54e,0.99996924,0.5124424,0.4875576,2022-03-02 18:24:19,Mediazona
"[idaf413338272f7c2ee354adb7631c8555|Лашин], шляпу надень,",fd9bbb850f242ac4eaeb819b2c8e38a6,0.9999963,0.6209893,0.3790107,2022-03-02 21:45:12,Mediazona
