text,user_id_hashed,war,ua,ru,datetime,media
"[id758ebb530ef608433c6bf4fcd443b531|Дмитрий], или пиздуй в свою укропию. А то прикрылся городом на Урале",fafbdd1ae674a1ab6654cfd66e0436cf,0.9999963,5.9609272e-05,0.9999404,2022-02-28 22:06:31,Mediazona
"[idfafbdd1ae674a1ab6654cfd66e0436cf|Алексей], скоро ко мне на Урал придут твои любимые ЧК сажать за госизмену. Только государства у нас больше нет, лол.",758ebb530ef608433c6bf4fcd443b531,0.9999963,0.47893557,0.52106446,2022-02-28 22:08:17,Mediazona
"[id758ebb530ef608433c6bf4fcd443b531|Дмитрий], мне вообще похуй на тебя и твой чк. Вы там все ебанулись из за этой войны.",fafbdd1ae674a1ab6654cfd66e0436cf,0.9999963,5.9609272e-05,0.9999404,2022-02-28 22:10:54,Mediazona
"[id758ebb530ef608433c6bf4fcd443b531|Дмитрий], а я с Сибири. И что теперь. Вообще никаким боком к этой обстановке на украине",fafbdd1ae674a1ab6654cfd66e0436cf,0.9999963,5.9609272e-05,0.9999404,2022-02-28 22:12:06,Mediazona
"[idfafbdd1ae674a1ab6654cfd66e0436cf|Алексей], ты из ботляндии, как и все вы, боты.",fbba9edd58bf9ff8eee60f4a44d07e2c,0.9999949,0.00544068,0.9945594,2022-03-01 07:58:26,Mediazona
"[idfbba9edd58bf9ff8eee60f4a44d07e2c|Анатолий], хуй Соси, урод укроповский. Я гражданин России, а ты блядь бандеровская",fafbdd1ae674a1ab6654cfd66e0436cf,0.9999963,5.9609272e-05,0.9999404,2022-03-01 10:49:50,Mediazona
"[idfafbdd1ae674a1ab6654cfd66e0436cf|Алексей], а где эти нацисты вна Украине ? Вы показать можете или только пересказ с телевизора?",6665d2853cda195dc1c0c1eb39afe5bf,0.9999945,0.30933753,0.69066244,2022-03-01 02:27:39,Mediazona
"[idfafbdd1ae674a1ab6654cfd66e0436cf|Алексей], балабол.",e6720a2c1b23108b96b3e78177bfaca1,0.99999607,0.9974356,0.002564422,2022-03-01 02:41:26,Mediazona
"[ide6720a2c1b23108b96b3e78177bfaca1|Ольга], курица",fafbdd1ae674a1ab6654cfd66e0436cf,0.9999963,5.9609272e-05,0.9999404,2022-03-01 07:21:18,Mediazona
"[id4689e277209a700aa936a033747cdeba|Марина], когда ты глава кинотеатров и у тебя есть подчинённые, то лучше работать, чем играть в ""пацифизм"" напускной и подписывать никому не нужные ""петиции""... Сейчас свободна и не боится она? ""у меня ипотека и кошка..."")",8dc9b49a85e8440ade2ea3e3c9084f1e,0.99996424,0.45260423,0.5473958,2022-03-01 01:29:36,Mediazona
"[id8dc9b49a85e8440ade2ea3e3c9084f1e|Николай], через неделю эти кинотеатры перестанут существовать. Максимум две.",d7265d154acec37b0d0f35d2b4ba4824,0.99999607,0.9993223,0.0006776676,2022-03-01 01:50:58,Mediazona
"[id8dc9b49a85e8440ade2ea3e3c9084f1e|Николай], бойся всю жизнь и трясись как чмо за паечку от хозяина.",b6e9458b4eae7973bcfa20c8a544d417,0.99999344,0.9928827,0.007117225,2022-03-01 02:52:48,Mediazona
"[idd7265d154acec37b0d0f35d2b4ba4824|Ольга], ну зато ""прославилась"" барышня... На ровном месте.. Показуха в чистом виде..",8dc9b49a85e8440ade2ea3e3c9084f1e,0.99996424,0.45260423,0.5473958,2022-03-01 02:53:06,Mediazona
"[idb6e9458b4eae7973bcfa20c8a544d417|Малкольм], я ветврач-ветсанэксперт.. На мпк.. Мне бояться чего то уже поздно.. И "" пайка от хозяина"" ни к чему",8dc9b49a85e8440ade2ea3e3c9084f1e,0.99996424,0.45260423,0.5473958,2022-03-01 02:55:14,Mediazona
"[id7571b5fec2c4fe10b103fdad63693fc4|Костя], если половина страны скажут нет, ничего не будет. Они обосруться.Все там ссыкуны голубые.",ebcc30486058378d262c0522637ca5f2,0.999995,0.012151049,0.987849,2022-03-01 05:07:34,Mediazona
"[idebcc30486058378d262c0522637ca5f2|Валерий], все люди за мир. Но только на Украине против. По этому, Россия несёт мир туда, где не хотят его. И чего эти люди которые за мир, раньше о нем не кричали? Поехали бы на Украину и кричали бы за мир. А чего о мире кричать сейчас, когда ВС РФ почти  донесли мир тем, кто не хотел мира? Странная философия.",c5d98194ed0c7ba0f54c3cc0136f02f6,0.9999963,4.9008882e-05,0.999951,2022-03-01 17:50:31,Mediazona
"[idd756f50252972f5c36893201a764f6e1|Алексей], почему не на передовой дядь ?",6665d2853cda195dc1c0c1eb39afe5bf,0.9999945,0.30933753,0.69066244,2022-03-01 02:27:58,Mediazona
"[id6665d2853cda195dc1c0c1eb39afe5bf|Александр], у всех своя. А к тебе уже идут.",d756f50252972f5c36893201a764f6e1,6.8179946e-07,0.0076098517,0.9923901,2022-03-01 02:35:14,Mediazona
"[idd756f50252972f5c36893201a764f6e1|Алексей], кто куда идёт ? Я в РФ живу дурень",6665d2853cda195dc1c0c1eb39afe5bf,0.9999945,0.30933753,0.69066244,2022-03-01 03:48:24,Mediazona
"[idd756f50252972f5c36893201a764f6e1|Алексей], иуда и пособник фашистов. Тебе заплатят не серебренниками, а свиным корытом.",758ebb530ef608433c6bf4fcd443b531,0.9999963,0.47893557,0.52106446,2022-03-01 04:23:31,Mediazona
"[id758ebb530ef608433c6bf4fcd443b531|Дмитрий], не дорого вы еврейчики родину продаёте, хоть цену озвучил. Да ты не обижайся потом будут чистить таких как ты.",d756f50252972f5c36893201a764f6e1,6.8179946e-07,0.0076098517,0.9923901,2022-03-01 05:48:50,Mediazona
"[idd756f50252972f5c36893201a764f6e1|Алексей], ты ебанутый. И вы утверждаете, что на Украине нацисты??",758ebb530ef608433c6bf4fcd443b531,0.9999963,0.47893557,0.52106446,2022-03-01 07:11:33,Mediazona
"[id758ebb530ef608433c6bf4fcd443b531|Дмитрий], да евреи с нациками как обычно, за Гитлера они тоже воевали, это все есть в интернете.",d756f50252972f5c36893201a764f6e1,6.8179946e-07,0.0076098517,0.9923901,2022-03-01 07:44:39,Mediazona
"[idd756f50252972f5c36893201a764f6e1|Алексей], тебе то сколько платят, жопу тут рвешь за власть, которой на нас пох",ee73022d20da7cd3292061b0be8f87de,0.99999595,0.5462357,0.45376435,2022-03-01 08:28:00,Mediazona
"[idee73022d20da7cd3292061b0be8f87de|Николай], я идейный, таких тварей органически не перевариваю.",d756f50252972f5c36893201a764f6e1,6.8179946e-07,0.0076098517,0.9923901,2022-03-01 08:31:10,Mediazona
"[id6b41f8678862a47f44a2a770e4f4f80b|Михаил], сколько платят за поедание говна?",758ebb530ef608433c6bf4fcd443b531,0.9999963,0.47893557,0.52106446,2022-03-01 04:23:59,Mediazona
"[id758ebb530ef608433c6bf4fcd443b531|Дмитрий], спроси у тех, кто кричит ""нетвойне""..",6b41f8678862a47f44a2a770e4f4f80b,0.9999534,0.0062638656,0.9937362,2022-03-01 04:34:56,Mediazona
"[id6b41f8678862a47f44a2a770e4f4f80b|Михаил], приятного аппетита мистер автоматический фашист.",758ebb530ef608433c6bf4fcd443b531,0.9999963,0.47893557,0.52106446,2022-03-01 07:12:28,Mediazona
"[id758ebb530ef608433c6bf4fcd443b531|Дмитрий], сложно общаться и тем более что-то доказывать малолетним дебилам.",6b41f8678862a47f44a2a770e4f4f80b,0.9999534,0.0062638656,0.9937362,2022-03-01 07:18:43,Mediazona
"[id6b41f8678862a47f44a2a770e4f4f80b|Михаил], нахуй пошел, и деда своего поехавшего забери",758ebb530ef608433c6bf4fcd443b531,0.9999963,0.47893557,0.52106446,2022-03-01 07:19:43,Mediazona
"[id6b41f8678862a47f44a2a770e4f4f80b|Михаил], за сколько совесть продал бот?",fbba9edd58bf9ff8eee60f4a44d07e2c,0.9999949,0.00544068,0.9945594,2022-03-01 07:56:25,Mediazona
"[idfbba9edd58bf9ff8eee60f4a44d07e2c|Анатолий], по поводу малолетних дебилов выше уже сказал.",6b41f8678862a47f44a2a770e4f4f80b,0.9999534,0.0062638656,0.9937362,2022-03-01 07:57:00,Mediazona
"[iddc6fab730ba7b823bf5b0daed8fb4e62|Гоша], нет фашизму в России! Нет войне!",ee73022d20da7cd3292061b0be8f87de,0.99999595,0.5462357,0.45376435,2022-03-01 20:09:46,Mediazona
NAKHUI SHKOLU EBAL SVOYU KLASSNUHU,2227f0019184fb3ccb7927390a8a740f,0.0014976154,0.5001514,0.4998486,2022-02-28 12:05:49,Mediazona
"ну и ""вождь"" , всё время юлит и не говорит Главного -""Идет не война с Украиной, а специальная миротворческая операция"" , благодаря которой вы можете просто умереть с голода , или от болезней , так как я умудрился настроить против России весь оставшийся мир , и так как экономики в России нет , как таковой , я всё разрушил , средств к существованию у вас не будет ...",93f9c8b7a72d6305e0ad4da3fc523b62,0.9999883,0.3409853,0.6590147,2022-02-28 12:09:19,Mediazona
"О, у меня тоже такая есть). Это еще не все, там шесть документов всего. Но уточню, нам ""порекомендовали""",29d045b0227a15d4fcb4538f2a597bb5,0.00013189978,0.022325553,0.9776744,2022-02-28 12:17:18,Mediazona
"Если учитель будет это втирать детям, то таких учителей нужно выгнать пожизненно.",0ce41ae0284e76cf6ae8fc3c7b98c5b0,0.9999956,0.9993024,0.0006976295,2022-02-28 12:27:58,Mediazona
"Кстати, втягивать детей в политику - преступление",77ab3e10895cbe3981dc74c5dab401e0,0.9999727,0.07658327,0.9234168,2022-02-28 12:32:34,Mediazona
какая же это мерзость,02cd375b87ad7f6d621a988b089a82fb,0.99997437,0.99993086,6.908295e-05,2022-02-28 12:36:40,Mediazona
"у нас запрещено говорить что-то, кроме предмета, и это правильно.",e6720a2c1b23108b96b3e78177bfaca1,0.99999607,0.9974356,0.002564422,2022-02-28 12:38:48,Mediazona
"Я читаю - и ох*еваю Это какой мр*зью надо быть, что бы так изворачивать реальность?",205f6616a3bd1ae7849ffbda2e31d63c,0.9999938,0.9817879,0.018212061,2022-02-28 13:37:58,Mediazona
"Украина и сейчас в ООН не признана в границах, так как с 1991 года её граница не определена и юридически она в РФ.",bc7b9689f28f689f903786e506950288,0.9998728,0.0005320325,0.999468,2022-02-28 13:42:20,Mediazona
А в чем не права методичка?,3e788877c56ee5bc6874b4132ac37eb0,0.9999962,0.00029508982,0.99970496,2022-02-28 14:16:15,Mediazona
"Я предлагаю , Польшу, Литву ,и Латвию захватить ещё по пути,чтобы два раза не ездить!!! При подумаем насчёт Меркель )))",ac1c3cb938a8e24f711347ea2bbe9f88,0.999995,0.038783625,0.96121633,2022-02-28 15:12:13,Mediazona
Пиздец!,5b4f2ba41223b5a981889b0265b9c722,0.9999957,0.0020631847,0.99793684,2022-02-28 15:28:51,Mediazona
"Всё правильно сказано в методичке, присутствующим бы самим почитать",11cff28d5a4cae07585f3d58756ea6e2,0.9999963,4.0736577e-05,0.99995923,2022-02-28 16:05:35,Mediazona
"Ну что, товарищи иноагенты, приготовились к 275 УК РФ и отмене моратория на смертную казнь?",352c41e99a0fb06add70c9e1aa6a2512,0.9999963,0.36329824,0.63670176,2022-02-28 16:10:01,Mediazona
Государства Россия тоженесуществовало так то... Появилось вместе с Путиным почти и то не слава богу как то),a7d02738a7c535ba6c88f43791ea7ee4,0.99999607,0.0013527608,0.9986473,2022-02-28 16:51:55,Mediazona
"Боже какие умные здесь, вы в начале со своей историей разберитесь,  почему на вашей земле уже вырастили второго тирана , Сталин   теперь Путин",f9fbdbda62b04089050c561d7bc9093b,0.9999958,0.81148404,0.188516,2022-02-28 16:58:15,Mediazona
"А какие выводы нужно сделать из того, что Украина появилась на карте только 100 лет назад? Да хоть 50 или 500. Ничего не меняет.",d37884ae3bb4c9e84e5cf113facde431,0.0001210069,0.00043289142,0.9995671,2022-02-28 17:16:28,Mediazona
"70 лет может и больше республика Украина была в составе Советского Союза, не каких разногласий не было, дружественные люди, всегда поделятся последним куском хлеба.",956d9f518c4e6409dfb3e67b38622bbf,0.00011951778,0.0006079391,0.99939203,2022-02-28 17:23:44,Mediazona
"Ну, Так-то это правда😁",7ed0bc437f28c7d6bdd38a795b6ccba8,0.00024662592,0.028665476,0.9713345,2022-02-28 18:51:04,Mediazona
"Если честно, учителям в данном случае надо включить мозги, совесть, и не зачитывать это детям. Эти уроки и их проведение все равно никто проверять не будет.",c070468e917ff4231067a6fc76b1d2af,0.9999958,0.00010666113,0.9998933,2022-02-28 19:49:29,Mediazona
Ну как-то же страны образовывались?,96cde0118c3a972051718a53db03690d,0.9999962,0.9999536,4.6331985e-05,2022-02-28 20:30:16,Mediazona
"Проект «россия» закрыл официально Путлер, можете расходиться.  В Венесуэле русских будут принимать еще, больше нигде походу, ну там природа хорошая - можно ехать отдыхать и историю преподавать детям.",8f517db4c12c5df797c4bdbd54b36b13,0.49779248,0.8137649,0.1862351,2022-02-28 20:45:33,Mediazona
пошла прошивочка,a03019580b2270c6af139d0cc10371b0,1.0314899e-05,0.9974457,0.0025543442,2022-03-01 00:33:28,Mediazona
И где здесь неправда???,2c25b635555d46ba52e5b2186c818418,0.9999962,5.0857165e-05,0.9999491,2022-03-01 01:22:15,Mediazona
И почему там не правда? США бомбила другие государства то же в мирных целях? Однобокая у вас информация @Медиазона.,97d853f5c473c4bcbe7732df988ca755,0.9999963,0.4229914,0.57700866,2022-03-01 03:06:03,Mediazona
Где неправда?,fc169d4d548352a15e002c6508c5b69f,0.9999894,0.021871911,0.978128,2022-03-01 04:46:49,Mediazona
"Израиль, Финляндия тоже не существовало",ebcc30486058378d262c0522637ca5f2,0.999995,0.012151049,0.987849,2022-03-01 05:37:56,Mediazona
"Русский военный корабль, иди нахуй.",34b80383ac875a564216c30a350e97bc,0.9999548,0.9994999,0.00050001865,2022-03-01 06:10:17,Mediazona
Тоже полностью поддерживаю,50d4316130daf643b209aa06a2b8bc8b,5.829932e-05,0.015918698,0.98408127,2022-03-01 07:46:49,Mediazona
Та то Росии нихуя не было. Имбецилы. Изолировать вас к хуям собачьим. Дебилы.,4c7f536c55f232f1416e75e207a2458a,0.9999927,0.2260387,0.77396137,2022-03-01 12:49:59,Mediazona
"Опубликованы списки российских солдат, участвующих в войне на Украине. Смотрите здесь, проверяйте живы ли. Полно срочников, требуйте вернуть их домой: https://drive.google.com/file/d/1va5E9IRWb73GY1vblTpro2U_7YWo7Pd0/view",54117e333bbf3f457d52cefc0317930c,2.4468159e-06,0.99936146,0.00063852855,2022-03-01 13:14:51,Mediazona
"В 1917 году в России произошел государственный переворот. К власти пришли алкаши, убийцы и балалаечники Шариковы. Отребье и отбросы общества, которым нечего терять. Все государственные границы России, все её законы, правовые акты и договоры, денежные знаки, паспорта и любые нотариально оформленные после 1917 года документы, удостоверения, свидетельства, справки и выписки, выданные после 1917 года, считать недействительными и неимеющими юридической силы. Россией 105 лет ПРАВИТ ХУНТА!",46c93df8e93ed170c671c06ceb155b5f,0.99999,0.995456,0.0045440476,2022-03-01 19:34:44,Mediazona
"[id2227f0019184fb3ccb7927390a8a740f|Алан], не переживай, для таких существ с расстройством гендерной идентичности принудительная диспансеризация - самое оно.",352c41e99a0fb06add70c9e1aa6a2512,0.9999963,0.36329824,0.63670176,2022-02-28 16:12:43,Mediazona
"[id352c41e99a0fb06add70c9e1aa6a2512|Макс], +15 помойных руснявых ублюдских нацистских копеяк.",2227f0019184fb3ccb7927390a8a740f,0.0014976154,0.5001514,0.4998486,2022-02-28 18:17:27,Mediazona
"[id93f9c8b7a72d6305e0ad4da3fc523b62|Дмитрий], он не юлит, это чисто юридическая тема. В 2015 году приняли закон о засекречивании военных потерь в мирное время. Поэтому чтобы секретить потери надо чтобы время было мирное, потому и спецоперация а не война.",f45d7029d23fe9bf334c5284f6263708,0.9999958,0.00015033195,0.9998497,2022-02-28 12:40:46,Mediazona
"[idf45d7029d23fe9bf334c5284f6263708|Михаил], по сути мирняк там не трогают, города не бомбят, гражданскую инфраструктуру не уничтожают.  Это обычная контр-террористическая операция, потому что на территории Украины вырастили аналоги ИГИЛ. Только у ИГИЛа радикальный ислам, а у Украины - радикальная русофобия.",352c41e99a0fb06add70c9e1aa6a2512,0.9999963,0.36329824,0.63670176,2022-02-28 16:16:31,Mediazona
"[id352c41e99a0fb06add70c9e1aa6a2512|Макс], годная мантра, продолжай, может в пресс-службу МИД РФ возьмут. Потом. Если захочешь.",f45d7029d23fe9bf334c5284f6263708,0.9999958,0.00015033195,0.9998497,2022-02-28 16:19:31,Mediazona
"[id5ae8b823a728fa5a057ab63427fa20d1|Михаил], сейчас не принято посылать к черту. Сейчас - ""русский военный корабль - иди на х@й""))",f45d7029d23fe9bf334c5284f6263708,0.9999958,0.00015033195,0.9998497,2022-02-28 16:54:52,Mediazona
"[id352c41e99a0fb06add70c9e1aa6a2512|Макс], мне это рассуждение понравилось.хотя нужны пояснения.вернее.так ли это на самом деле",11ea1e143148c5888f6f570343330eff,0.9999962,5.061697e-05,0.99994934,2022-02-28 17:58:23,Mediazona
"[id93f9c8b7a72d6305e0ad4da3fc523b62|Дмитрий], а когда шла не карательная операция со стороны украины, собственно и  начавшая войну, а ""контртеррористическая операция"" - все было хорошо? Или мы не понимаем и это другое?",888396b9eaaa17f4a3d7aa728ed435da,0.9999939,0.0011557738,0.9988442,2022-02-28 19:51:51,Mediazona
"[idf45d7029d23fe9bf334c5284f6263708|Михаил], это вы случайно не про тот корабль на котором и привезли этих 83 (или сколько то там) посылателей на х√й, которых собственная страна похоронила?🤣",7c8e3494fc7b8ec904f687dce1b4c793,0.9999881,0.04165025,0.95834976,2022-02-28 20:44:33,Mediazona
"[id7c8e3494fc7b8ec904f687dce1b4c793|Андрей], про них, про них. Не буду рассуждать правда это или нет, есть разные версии, однако мем родился, мем сильный, на основании этого мема родилось множество эмоционально воздействующих произведений искусства, в том числе стихи Д. Быкова. Ну а песенку с клипом под названием ""русский военный корабль ..."" сами на ютубе найдете при желании.",f45d7029d23fe9bf334c5284f6263708,0.9999958,0.00015033195,0.9998497,2022-02-28 22:19:10,Mediazona
"[id352c41e99a0fb06add70c9e1aa6a2512|Макс], скажи это мудак погибшим детям",881a10a53e904746315e7c7362d87a13,0.9999963,0.99995375,4.6273442e-05,2022-03-01 01:21:56,Mediazona
"[id352c41e99a0fb06add70c9e1aa6a2512|Макс], член изо рта вынь, потом уже говори",d64478173554aba3e7bb4550bcb686d6,0.017235173,0.033598114,0.9664019,2022-03-01 06:02:15,Mediazona
"[id5ae8b823a728fa5a057ab63427fa20d1|Михаил], с таким же успехом тебя можно на Донбасс отправить жить.",05328a843bc6b5fa497088005bd34583,0.9999877,9.592423e-05,0.99990404,2022-03-01 21:44:09,Mediazona
я там и живу,5ae8b823a728fa5a057ab63427fa20d1,0.9999639,0.00055689085,0.9994431,2022-03-01 21:58:47,Mediazona
"[id5ae8b823a728fa5a057ab63427fa20d1|Михаил], Да-да, конечно.",05328a843bc6b5fa497088005bd34583,0.9999877,9.592423e-05,0.99990404,2022-03-01 22:15:50,Mediazona
"[id0ce41ae0284e76cf6ae8fc3c7b98c5b0|Генрих], если бы не большевики хохлов бы не было",9b4eb42bfb961cea5177da6b34c056af,0.9994166,0.46124262,0.53875744,2022-02-28 14:14:48,Mediazona
"[id9b4eb42bfb961cea5177da6b34c056af|Эдвард], иди Истрию учи. Только не слов плешивого.",0ce41ae0284e76cf6ae8fc3c7b98c5b0,0.9999956,0.9993024,0.0006976295,2022-02-28 14:26:36,Mediazona
"[id0ce41ae0284e76cf6ae8fc3c7b98c5b0|Генрихъ], киевская губерния есть , украины нету , вопросы?",9b4eb42bfb961cea5177da6b34c056af,0.9994166,0.46124262,0.53875744,2022-02-28 14:27:39,Mediazona
"[id9b4eb42bfb961cea5177da6b34c056af|Эдвард], если бы монголов не было, то России не существовало бы.",0ce41ae0284e76cf6ae8fc3c7b98c5b0,0.9999956,0.9993024,0.0006976295,2022-02-28 14:29:00,Mediazona
"[id0ce41ae0284e76cf6ae8fc3c7b98c5b0|Генрихъ], хохол попался",9b4eb42bfb961cea5177da6b34c056af,0.9994166,0.46124262,0.53875744,2022-02-28 14:29:23,Mediazona
"[id9b4eb42bfb961cea5177da6b34c056af|Эдвард], что тебя не устраивает, чудовище лесное?",0ce41ae0284e76cf6ae8fc3c7b98c5b0,0.9999956,0.9993024,0.0006976295,2022-02-28 14:30:28,Mediazona
"[id0ce41ae0284e76cf6ae8fc3c7b98c5b0|Генрихъ], почему ты не на фронте не защищаешь легетимность украины?",9b4eb42bfb961cea5177da6b34c056af,0.9994166,0.46124262,0.53875744,2022-02-28 14:31:45,Mediazona
"[id9b4eb42bfb961cea5177da6b34c056af|Эдвард], потому что я не из Украины. Так че там с монголами? Когда им вернёте их земли?",0ce41ae0284e76cf6ae8fc3c7b98c5b0,0.9999956,0.9993024,0.0006976295,2022-02-28 14:32:38,Mediazona
"[id0ce41ae0284e76cf6ae8fc3c7b98c5b0|Генрихъ], ооо так ты не русь , сказал бы сразу",9b4eb42bfb961cea5177da6b34c056af,0.9994166,0.46124262,0.53875744,2022-02-28 14:33:05,Mediazona
"[id9b4eb42bfb961cea5177da6b34c056af|Эдвард], так че слив, пропагандист дешёвый? Че та быстро ты. Ещё и нациком оказался.",0ce41ae0284e76cf6ae8fc3c7b98c5b0,0.9999956,0.9993024,0.0006976295,2022-02-28 14:34:30,Mediazona
"[id0ce41ae0284e76cf6ae8fc3c7b98c5b0|Генрихъ], где тут нацизм опёздaл?",9b4eb42bfb961cea5177da6b34c056af,0.9994166,0.46124262,0.53875744,2022-02-28 14:35:40,Mediazona
