text,user_id_hashed,war,ua,ru,datetime,media
"Стоп, по официальной версии РФ ведёт операцию  против националистов, а не воюет с украинской арией. Я что-то путаю?",1fb0f6f441d87d298165a89ef4551f71,0.9999937,0.00014629732,0.99985373,2022-02-27 11:31:56,Mediazona
#нетвойне #импичментПутину,103a979545b98d062d409a0c94133dc2,0.9999894,0.00010289076,0.9998971,2022-02-27 11:32:57,Mediazona
"Я финансировал украинскую армию, возбуждайте меня полностью! #яфинансировал",99e4df0e1f1b7c560ccfe95f9288d063,0.9999894,7.780543e-05,0.99992216,2022-02-27 11:37:00,Mediazona
"Сейчас начнётся)) Не надо жертвовать в Украинским , пожертвуйте нашим!! Благодаря тебе Отмороженный победодед !! Скоро и помогать будет нечем!!",1f310970c863242960d18a7f32c266cb,0.99998784,0.40223992,0.59776,2022-02-27 11:46:35,Mediazona
Госизмена и терроризм сама путинская преступная операция - война,24ac768f16e37996325aa6ffc3c44792,0.9999963,0.99994946,5.0573963e-05,2022-02-27 11:49:40,Mediazona
"Госизмена у людей, которые этим пид0рам даже не присягали",b6e9458b4eae7973bcfa20c8a544d417,0.99999344,0.9928827,0.007117225,2022-02-27 12:13:55,Mediazona
Тупин - военный преступник или психбольной? Генпрокуратура разберись.,fa90ec7a3e5f4d6260c90840ff0c8fea,0.9999963,0.760204,0.239796,2022-02-27 12:30:05,Mediazona
"Ну, потому что донатить украинской армии это измена: на эти деньги убивают русских солдат. В любой другой цивилизованной стране так. Вот, например, уголовный кодекс США (https://uscode.house.gov/view.xhtml?path=/prelim@title18/part1/chapter115&edition=prelim): « 2381. Treason Whoever, owing allegiance to the United States, levies war against them or adheres to their enemies, giving them aid and comfort within the United States or elsewhere, is guilty of treason and shall suffer death»",f64ba56ba090fd759d6dd51551c8f073,0.9999963,5.226432e-05,0.9999478,2022-02-27 13:23:49,Mediazona
"Госизмена, это когда террористу вручаешь ""Героя РФ""",3dc795d6fa1293d60d18e6a10c361da1,0.9999826,0.046069063,0.9539309,2022-02-27 13:33:12,Mediazona
"вы ебанулись? это абсолютно логичное действие в чем претензия? посылая деньги укр военным вы спонсируете убийство русских солдат, и затягиваете конфликт, каждый час которого кому-то стоит жизни, а кто там прав, кто не прав - это уже десятое дело",c3f73c296131d048de2d5653e33c6018,0.9999963,4.1372947e-05,0.99995863,2022-02-27 14:21:52,Mediazona
Сволочи,3102d6f0aa41588eb8ad20da03fb4df6,0.9999956,0.0020343664,0.9979657,2022-02-27 15:44:47,Mediazona
Гос измена поддерживать фашистский режим #Путина,5e99124187c2479446c064c86c8b0ed2,5.814631e-07,0.99994934,5.069757e-05,2022-02-27 16:51:57,Mediazona
"Прокуроры ездят пьяные в говно убивая детей и взрослых,  а родственникам в Украине помочь нельзя.  Ну и кто тут госизменник?  🤔",c2229627c5087cc55ac2de35d33734f2,0.99999154,0.042565104,0.9574349,2022-02-27 19:03:23,Mediazona
А где кремлеботы?,4bc8a8574f50b8e79f9723b003cab7f9,0.99996734,0.19524439,0.80475557,2022-02-28 07:39:06,Mediazona
Правильно сделала прокуратура,11cff28d5a4cae07585f3d58756ea6e2,0.9999963,4.0736577e-05,0.99995923,2022-02-28 16:11:28,Mediazona
"[id04a779279e25bbf76c85679cdb150eae|Анна], вчера Димон за смертную казнь топил. Все сходится ))",3916e72b84b2bb8aaf9ecce11bc50fd0,0.9999937,0.058590893,0.9414092,2022-02-27 11:57:36,Mediazona
"[idebcc30486058378d262c0522637ca5f2|Валерий], Талибан и симпсоны осудили эту войну",8d7a8d00a9c2dc0dd4d4a3eab8dcccd7,0.9999964,0.013350495,0.9866496,2022-02-27 15:39:29,Mediazona
"[id1fb0f6f441d87d298165a89ef4551f71|Георгий], не путаешь..",6f8c11d4f7aff3cb170c39ad88e703fb,0.99999595,0.0001964788,0.9998035,2022-02-27 14:48:13,Mediazona
"[id1f310970c863242960d18a7f32c266cb|Нигер], списками пускай соберают. И там кадр давайте витиньке соберём на шлем, а то он там в пацанскрй шапке бегает ))",1425406642d8ef4d9a8a303e74bc5b44,0.9999963,0.99825203,0.0017479819,2022-02-27 12:12:58,Mediazona
"[idc3f73c296131d048de2d5653e33c6018|Андрей], война уже окончена",062e6e7607b43f25793be47bfc6e4973,0.9999927,0.4578623,0.5421377,2022-02-27 15:19:09,Mediazona
"[id5e99124187c2479446c064c86c8b0ed2|Антон], правильно, поддерживай Навального, чтобы его жена новым брюликам порадовалась",11cff28d5a4cae07585f3d58756ea6e2,0.9999963,4.0736577e-05,0.99995923,2022-02-28 16:12:55,Mediazona
Скинулись бы на киллера. Вместо этих вечеринок. Не понимаю.,9d4518b4f1fa8a438720456b54c749f9,0.99999523,0.46750367,0.5324964,2022-02-27 09:41:31,Mediazona
Это как больные раком скидываются с окон из-за того что им геру щапретили. Так ты кидайся на тех кто запретил. Нет. Назло бабушке уши отморожу.,9d4518b4f1fa8a438720456b54c749f9,0.99999523,0.46750367,0.5324964,2022-02-27 09:45:05,Mediazona
#нетвойне #импичментПутину,103a979545b98d062d409a0c94133dc2,0.9999894,0.00010289076,0.9998971,2022-02-27 10:44:20,Mediazona
"Есть честные люди в России, есть!!",ca8a2a15e9c4f2f6729c3f217081fac8,0.99997723,0.9801319,0.019868039,2022-02-27 12:25:14,Mediazona
После этого пи.ора Примаков за.бался восстанавливать заводы (примерно 286 было уничтожено).,e5898582c18397a8dab47431c60cfefe,0.99999607,0.38449892,0.6155011,2022-02-27 16:10:25,Mediazona
"Пророчил мужик все абсолютно до мелочей, и даже про «спецоперацию» ещё 7 лет назад, взяли да кокнули ироды.",4cea9d83a6541a3c04e3ad66c6a61985,0.0009454719,0.115934044,0.8840659,2022-03-01 11:55:38,Mediazona
"[id9d4518b4f1fa8a438720456b54c749f9|Дмитрий], ебать наивность",d4b1f91da895099bea1f1aa3af1437d5,0.9999962,0.0046049017,0.9953952,2022-02-27 09:59:24,Mediazona
"[idd4b1f91da895099bea1f1aa3af1437d5|John], ну вот так.",9d4518b4f1fa8a438720456b54c749f9,0.99999523,0.46750367,0.5324964,2022-02-27 09:59:58,Mediazona
"[id9d4518b4f1fa8a438720456b54c749f9|Дмитрий], смирись с тем что мы анальные сучки, дохуя людей ещё и рады",d4b1f91da895099bea1f1aa3af1437d5,0.9999962,0.0046049017,0.9953952,2022-02-27 10:00:43,Mediazona
"[idd4b1f91da895099bea1f1aa3af1437d5|John], так и живём.",9d4518b4f1fa8a438720456b54c749f9,0.99999523,0.46750367,0.5324964,2022-02-27 10:01:19,Mediazona
"[idd4b1f91da895099bea1f1aa3af1437d5|John], я тебе что, ливалющионер? Ну хватит. Я рашинский терпилоид. При мне конституцию изнасиловали и пенсионный возраст подняли. Отстань.",9d4518b4f1fa8a438720456b54c749f9,0.99999523,0.46750367,0.5324964,2022-02-27 10:03:22,Mediazona
"[id9d4518b4f1fa8a438720456b54c749f9|Дмитрий], по ощущениям процентов 60 людей хотят совок обратно со всеми вытекающими",d4b1f91da895099bea1f1aa3af1437d5,0.9999962,0.0046049017,0.9953952,2022-02-27 10:04:30,Mediazona
"[idd4b1f91da895099bea1f1aa3af1437d5|John], не хотят. А совочек уже туточки. Даже гимн тот же.",9d4518b4f1fa8a438720456b54c749f9,0.99999523,0.46750367,0.5324964,2022-02-27 10:05:36,Mediazona
"[id9d4518b4f1fa8a438720456b54c749f9|Дмитрий], из всех людей 40+ с кем я общался, ни один не был активно против того что сейчас происходит, из 30тилетних тоже многим в кайф, но уже меньше",d4b1f91da895099bea1f1aa3af1437d5,0.9999962,0.0046049017,0.9953952,2022-02-27 10:07:37,Mediazona
"[idd4b1f91da895099bea1f1aa3af1437d5|John], я 40 плюс. Работаю с такими же. Все в афве от адика.",9d4518b4f1fa8a438720456b54c749f9,0.99999523,0.46750367,0.5324964,2022-02-27 10:08:58,Mediazona
"[id9d4518b4f1fa8a438720456b54c749f9|Дмитрий], ну у меня в окружении по-другому, глубинный народ больше рад",d4b1f91da895099bea1f1aa3af1437d5,0.9999962,0.0046049017,0.9953952,2022-02-27 10:09:48,Mediazona
"[idd4b1f91da895099bea1f1aa3af1437d5|John], в смысле от пыри.",9d4518b4f1fa8a438720456b54c749f9,0.99999523,0.46750367,0.5324964,2022-02-27 10:09:55,Mediazona
"[id9d4518b4f1fa8a438720456b54c749f9|Дмитрий], я про войну чисто, многие рил рады, я в ахуе",d4b1f91da895099bea1f1aa3af1437d5,0.9999962,0.0046049017,0.9953952,2022-02-27 10:10:25,Mediazona
"[idd4b1f91da895099bea1f1aa3af1437d5|John], понаехавшие наверное из сёл.",9d4518b4f1fa8a438720456b54c749f9,0.99999523,0.46750367,0.5324964,2022-02-27 10:10:33,Mediazona
"[id9d4518b4f1fa8a438720456b54c749f9|Дмитрий], да нет вроде",d4b1f91da895099bea1f1aa3af1437d5,0.9999962,0.0046049017,0.9953952,2022-02-27 10:10:53,Mediazona
"[id9d4518b4f1fa8a438720456b54c749f9|Дмитрий], шизов полно везде чувак",d4b1f91da895099bea1f1aa3af1437d5,0.9999962,0.0046049017,0.9953952,2022-02-27 10:11:05,Mediazona
"[idd4b1f91da895099bea1f1aa3af1437d5|John], чел, НИ ОДНОГО НЕ ЗНАЮ радующего войне. Правда. Даже самый отбитые ватники офуевают от.0",9d4518b4f1fa8a438720456b54c749f9,0.99999523,0.46750367,0.5324964,2022-02-27 10:12:08,Mediazona
"[id9d4518b4f1fa8a438720456b54c749f9|Дмитрий], блять они это войной не называют, спецоперацией, и считают что это нужно чтобы остановить нацистов из правительства Украины которые 8 лет стреляли по днр и лнр",d4b1f91da895099bea1f1aa3af1437d5,0.9999962,0.0046049017,0.9953952,2022-02-27 10:13:28,Mediazona
"[idd4b1f91da895099bea1f1aa3af1437d5|John], называют. Чел, отвечу, даже ватаня офуевают.  Ты не в энторнете спроси а на улице.",9d4518b4f1fa8a438720456b54c749f9,0.99999523,0.46750367,0.5324964,2022-02-27 10:15:29,Mediazona
"[id9d4518b4f1fa8a438720456b54c749f9|Дмитрий], ты дебик? я у себя на работе у всех спросил, чо ты мне лечишь",d4b1f91da895099bea1f1aa3af1437d5,0.9999962,0.0046049017,0.9953952,2022-02-27 10:15:54,Mediazona
"[idd4b1f91da895099bea1f1aa3af1437d5|John], ладно",9d4518b4f1fa8a438720456b54c749f9,0.99999523,0.46750367,0.5324964,2022-02-27 10:16:31,Mediazona
"[ida1ec751d25ea5aa8fc29e7b7e395d6d0|Елисей], у парней в метадичках только ""что там у хохлов"" ... Ему пришлось напрягать мозги и импровизировать",4e2f13d221e99e1df23e143ff5f7fc5e,0.9999963,0.6074859,0.3925141,2022-02-27 09:53:55,Mediazona
"[ida1ec751d25ea5aa8fc29e7b7e395d6d0|Елисей], что ты не понял? Люди вместо активных действий дpoчат друг другу на мосте.",9d4518b4f1fa8a438720456b54c749f9,0.99999523,0.46750367,0.5324964,2022-02-27 09:56:26,Mediazona
"[id4e2f13d221e99e1df23e143ff5f7fc5e|Deja_vu], смищно",9d4518b4f1fa8a438720456b54c749f9,0.99999523,0.46750367,0.5324964,2022-02-27 09:59:13,Mediazona
Ясно. Адик сбрил усы.,9d4518b4f1fa8a438720456b54c749f9,0.99999523,0.46750367,0.5324964,2022-02-27 08:00:13,Mediazona
Хорошо Понимаю Зеленского. С таких переговоров можно и не вернуться.,3f3f1405d8fc717349e8eb130a6677d2,0.99989545,0.5047991,0.4952009,2022-02-27 08:08:09,Mediazona
"А в другие царек боится ехать, могут наплевать на дипломатию и отправить его на трибунал.",051efd94929d64ca2cc51e7e1da70620,0.9999964,0.00030378826,0.99969625,2022-02-27 08:29:41,Mediazona
"Вся техника русни, уничтожается на подступах. Русню жгут живьём. Рассеянские мамы и папы, пожалуйста заберите трупы своих выблядков. У нас тепло и есть чем топить..",9eed7075d1c3b69c317d2362e73daaf3,0.9999956,0.9999484,5.166856e-05,2022-02-27 08:56:02,Mediazona
"[id3f3f1405d8fc717349e8eb130a6677d2|Дина], дай Бог хватило бы ума взять росделегацию под стражу.",87b1ae8095eba4bc070eb310a1249c8b,0.9999958,0.7686234,0.2313766,2022-02-27 08:08:52,Mediazona
"[id3f3f1405d8fc717349e8eb130a6677d2|Дина], ты думаешь там презики встречаться будут? Уполномоченных пошлют, которые никому нахрен не нужны убивать их",046b15cf2530dbec62204c1fa13033fc,0.9999957,0.8978316,0.102168374,2022-02-27 14:27:38,Mediazona
"[id046b15cf2530dbec62204c1fa13033fc|Андрей], скорее соглашусь с Вами.",3f3f1405d8fc717349e8eb130a6677d2,0.99989545,0.5047991,0.4952009,2022-02-27 14:50:22,Mediazona
ютуб скоро рип походу,737d63f95c8484f7ab9e52694e456890,0.93650925,0.04456401,0.95543605,2022-02-26 20:44:46,Mediazona
"Свобода слова по пиндоски, блокировать СМИ)",e32464c7d3d409e46171f3eb6cdcd4c9,0.99999595,0.35379964,0.6462004,2022-02-26 20:52:40,Mediazona
"Дави их,блдь,этих пропагандонов боброедки😊 👍🏻",b69009584b5c8a35abf5fdc05648d3ae,0.0006330809,0.9992956,0.00070443214,2022-02-26 21:02:20,Mediazona
Ах не ебаться в телевизор прям усравшись,9eed7075d1c3b69c317d2362e73daaf3,0.9999956,0.9999484,5.166856e-05,2022-02-26 21:03:11,Mediazona
"Молодцы,почистили пространство от грязи!",9a9ce4cba78e16a2a99906e460d8c7f3,3.2642472e-06,0.8684068,0.13159317,2022-02-26 21:14:04,Mediazona
парашу тудой снова опустили,c28378214c5d4ff8212876ad0a3c87a6,0.9999963,0.5225107,0.47748932,2022-02-26 21:27:32,Mediazona
"Мне кажется зря они это делают. Надо наоборот, больше показывать гнусную рожу Симоньян, смешные истерики Соловьева ну и виновника торжества с его ""бЕндеровцами"" и ""наркоманами"". Сами их лица вызывают у нормального человека омерзение а возможности пропогандистской накачки они уже исчерпали, целевая аудитория уже безнадежно зомбирована, а оставшимся их рожи и слова отвратительны.",f45d7029d23fe9bf334c5284f6263708,0.9999958,0.00015033195,0.9998497,2022-02-26 23:55:12,Mediazona
ссссссип,96c199885506dc7ad0a3dee897c45a10,0.99999547,0.4218416,0.57815844,2022-02-27 06:18:55,Mediazona
На.,92bcffda5eb63badec0e1211c4fec018,0.9999181,0.0105732335,0.98942673,2022-02-27 07:58:53,Mediazona
"[id737d63f95c8484f7ab9e52694e456890|Pasha], ну попытаются. Ведь знают что ютуб смотрит народ.",b5b1297dda9daac49cb753c3bc5cc5aa,0.99998045,0.29201508,0.7079849,2022-02-26 20:46:34,Mediazona
"[ide32464c7d3d409e46171f3eb6cdcd4c9|Xaker], RT-с чего ты взял, что это сми? по тебе и Путин-президент?",fd9bbb850f242ac4eaeb819b2c8e38a6,0.9999963,0.6209893,0.3790107,2022-02-26 21:01:44,Mediazona
"[idfd9bbb850f242ac4eaeb819b2c8e38a6|Валерий], а может и президент, для моих врагов вообще император и царь.🤣",e32464c7d3d409e46171f3eb6cdcd4c9,0.99999595,0.35379964,0.6462004,2022-02-26 21:04:02,Mediazona
"[ide32464c7d3d409e46171f3eb6cdcd4c9|Xaker], раша тудей это не сми, это рупор пропаганды",b6e9458b4eae7973bcfa20c8a544d417,0.99999344,0.9928827,0.007117225,2022-02-26 21:07:43,Mediazona
"[idb6e9458b4eae7973bcfa20c8a544d417|Малкольм], без разницы что это, речь идёт о цензуре, что это если не она?",e32464c7d3d409e46171f3eb6cdcd4c9,0.99999595,0.35379964,0.6462004,2022-02-26 21:08:26,Mediazona
"[idb6e9458b4eae7973bcfa20c8a544d417|Малкольм], та же история с телеграмм, как ркн делал запросы так устроили целую акцию, как Германия пригрозила запретом так сразу хвосты поджали и скуколдились. А левацки залупы и дальше будут свою же страну не уважать, поколение долбаебов-навальнистов",e32464c7d3d409e46171f3eb6cdcd4c9,0.99999595,0.35379964,0.6462004,2022-02-26 21:10:06,Mediazona
"[ide32464c7d3d409e46171f3eb6cdcd4c9|Xaker], ну блюй тогда,",fd9bbb850f242ac4eaeb819b2c8e38a6,0.9999963,0.6209893,0.3790107,2022-02-26 21:44:20,Mediazona
"[ide32464c7d3d409e46171f3eb6cdcd4c9|Xaker], начинай скулить про ""это другое"", додик",79824a9d917f361f2d5b9aa75d43f791,0.9999912,0.067534044,0.9324659,2022-02-26 21:48:41,Mediazona
"[id79824a9d917f361f2d5b9aa75d43f791|Vladimir], спешу заверить, это по***. https://www.google.com/search?q=%D1%81%D0%BC%D0%B5%D1%88%D0%BD%D0%BE+%D0%B0%D0%B6+%D0%B0%D0%B6+%D1%81%D0%BA%D1%83%D0%BB%D1%8B+%D1%81%D0%B2%D0%BE%D0%B4%D0%B8%D1%82",96c199885506dc7ad0a3dee897c45a10,0.99999547,0.4218416,0.57815844,2022-02-27 06:30:09,Mediazona
"[id79824a9d917f361f2d5b9aa75d43f791|Vladimir], желтущий заголовок для недоумков",e32464c7d3d409e46171f3eb6cdcd4c9,0.99999595,0.35379964,0.6462004,2022-02-27 09:28:57,Mediazona
"[ide32464c7d3d409e46171f3eb6cdcd4c9|Xaker], ахах, вместо ""это другое"" решил сыграть в выфсёврёти, гений",79824a9d917f361f2d5b9aa75d43f791,0.9999912,0.067534044,0.9324659,2022-02-27 11:56:16,Mediazona
"Ничего себе война: за три дня двадцать погибших… Мабуть, не всех посчиталы?!",e30170d15d1eec5e637b2dab712d704f,0.99999523,0.5006883,0.49931166,2022-02-26 19:38:12,Mediazona
Эту войну нужно было останавливать ещё 8 лет назад когда ВСУ вошли в Донбасс и бомбили его беспощадно!,4beaa78c67935a66e0ea6867f3f18e10,0.99999595,7.776353e-05,0.9999223,2022-02-26 21:00:27,Mediazona
А он ничего не сказал про семью которую в машине расстреляли? Он их тоже в этот список посчитал?,35f38434af5a2fd8db4c8b1b5335bb80,0.99999607,0.32419527,0.67580473,2022-02-27 00:04:40,Mediazona
"[id5bb647e6dd2e23194405fbaf5db54161|Тимофей], ПОДПИШИ ЭТУ ГРЕБАНУЮ ПЕТИЦИЮ",af2939a35f02260c78d6dc1edbb07cef,0.9999584,0.02641031,0.97358966,2022-02-26 19:38:36,Mediazona
"[idaf2939a35f02260c78d6dc1edbb07cef|Виктор],",e6720a2c1b23108b96b3e78177bfaca1,0.99999607,0.9974356,0.002564422,2022-02-27 00:22:21,Mediazona
хадолбал,96c199885506dc7ad0a3dee897c45a10,0.99999547,0.4218416,0.57815844,2022-02-27 06:20:04,Mediazona
"Елена, иди нах@й лох пригожинский! https://gosvon.net/?usr=333807904 https://gosvon.net/photo.php?id=333807904",db5a95d3679f03a0046ca80971255ded,0.99999535,0.15819776,0.84180224,2022-02-26 19:39:05,Mediazona
"[iddb5a95d3679f03a0046ca80971255ded|Илья], сам туда и иди, помойный рот! Мне твои картинки до одного места",e30170d15d1eec5e637b2dab712d704f,0.99999523,0.5006883,0.49931166,2022-02-26 19:54:36,Mediazona
"[id4beaa78c67935a66e0ea6867f3f18e10|Vladimir], это рф 8 лет назад её начала",700f8556a0f3940eb782488c8a341e1f,0.9999927,0.36101675,0.63898325,2022-02-27 08:12:20,Mediazona
Путин - это война! #ДедУходи #НетВойне #StopTheWar #PutinWar,db5a95d3679f03a0046ca80971255ded,0.99999535,0.15819776,0.84180224,2022-02-26 18:40:43,Mediazona
Мы это уже видим с 2014 года. Почему вы увидели это сейчас?,b6548883eff8dd38415552dc7f60733d,0.99999464,0.00014205399,0.9998579,2022-02-26 18:43:47,Mediazona
"А почему они в Польшу уходят, а не в Россию?",98ad0eebc92e8aa7412b698d4d541f6d,0.999992,0.9209663,0.07903371,2022-02-26 18:52:20,Mediazona
"Мирные жители Донецка в настоящий момент под обстрелами украинских градов. А она, бедная, ""не спала"".)))",d0cdb861728a6f1e99e44464fec0c54f,0.9999962,0.0075630248,0.99243695,2022-02-26 18:53:03,Mediazona
Медные дожди 🏵 https://vk.com/@superborea-dozhdi,56cd7cf96ba6fae2403569796f8e72da,0.89951146,0.0008165371,0.9991835,2022-02-26 21:43:43,Mediazona
"[iddb5a95d3679f03a0046ca80971255ded|Илья], до победного конца",137d1ea579f5e9995d8b921caf0ffb09,0.99998486,0.2881944,0.71180564,2022-02-26 22:31:59,Mediazona
"[id137d1ea579f5e9995d8b921caf0ffb09|Дмитрий], до победы над Путиным и его ОПГ",270e8691913a206d1c012400936124fa,3.520096e-05,0.2456683,0.7543317,2022-02-27 16:14:28,Mediazona
"[idb6548883eff8dd38415552dc7f60733d|Vladislav], не знал, что в Энгельсе военные рф «спецоперации» проводят с 2014",54e0a2f133c323c0610022e65745fee4,0.9999937,0.9997688,0.00023120057,2022-02-26 19:22:20,Mediazona
"[id54e0a2f133c323c0610022e65745fee4|Антон], я так то с Донбасса, если что.",b6548883eff8dd38415552dc7f60733d,0.99999464,0.00014205399,0.9998579,2022-02-26 19:23:57,Mediazona
"[idb6548883eff8dd38415552dc7f60733d|Vladislav], и уехал ты когда?",54e0a2f133c323c0610022e65745fee4,0.9999937,0.9997688,0.00023120057,2022-02-26 19:24:30,Mediazona
"[idb6548883eff8dd38415552dc7f60733d|Владислав], а ты почему только сейчас объявился? Где был-то 8 лет?",d5503d06d910f63c261122267619f78e,6.786986e-05,0.03589415,0.96410584,2022-02-26 22:39:19,Mediazona
"[id98ad0eebc92e8aa7412b698d4d541f6d|Азрет], потому что они сука не дураки.",445b643e26e13b5096fc25cb2143aa4c,0.9972924,0.02731651,0.9726835,2022-02-26 19:19:55,Mediazona
"[id98ad0eebc92e8aa7412b698d4d541f6d|Азрет], потому что боятся отвечать за свои преступления",137d1ea579f5e9995d8b921caf0ffb09,0.99998486,0.2881944,0.71180564,2022-02-26 22:32:34,Mediazona
"[id137d1ea579f5e9995d8b921caf0ffb09|Дмитрий], а куда вы побежите?)",98ad0eebc92e8aa7412b698d4d541f6d,0.999992,0.9209663,0.07903371,2022-02-27 05:59:34,Mediazona
"[id137d1ea579f5e9995d8b921caf0ffb09|Дмитрий], какие преступления совершало мирное население Украины?",14b50316eee1ce944dc43f12e451acb7,0.9999963,0.40633368,0.5936664,2022-02-27 11:25:51,Mediazona
"[id14b50316eee1ce944dc43f12e451acb7|Дима], Россия мирное население не обижает",137d1ea579f5e9995d8b921caf0ffb09,0.99998486,0.2881944,0.71180564,2022-02-27 11:26:26,Mediazona
"[idd0cdb861728a6f1e99e44464fec0c54f|Юлия], обстрелы там идут даже сейчас?",6f8c11d4f7aff3cb170c39ad88e703fb,0.99999595,0.0001964788,0.9998035,2022-02-26 19:23:36,Mediazona
"[id6f8c11d4f7aff3cb170c39ad88e703fb|Вадим], два часа назад начали, как в данный момент - хз. Помимо градов применяют ""точку У"". Две перехвачены.",d0cdb861728a6f1e99e44464fec0c54f,0.9999962,0.0075630248,0.99243695,2022-02-26 19:26:13,Mediazona
"[idd0cdb861728a6f1e99e44464fec0c54f|Юлия], наши вояки сообщали, что там фронт отодвинулся на 25 км..Странно..(((",6f8c11d4f7aff3cb170c39ad88e703fb,0.99999595,0.0001964788,0.9998035,2022-02-26 19:27:43,Mediazona
